Question,Answer,Q_Timestamp,A_Timestamp,QA_Index,year,quarter,assertive_expected_value,assertive_cumulative_tone,assertive_change_point,cautious_expected_value,cautious_cumulative_tone,cautious_change_point,optimistic_expected_value,optimistic_cumulative_tone,optimistic_change_point,specific_expected_value,specific_cumulative_tone,specific_change_point,clear_expected_value,clear_cumulative_tone,clear_change_point,relevant_expected_value,relevant_cumulative_tone,relevant_change_point
"As a follow-up question, if you could talk a bit to the benefit that you may have seen from some of the carrier actions, some very aggressive trade-ins during the quarter. Did that provide a benefit in your view on units or mix or perhaps both? And what would be the level of permanence that you would see in some of those actions such that, you know, if those subsidies were removed, could that potentially be a headwind going forward?","I think, Chris, it's Tim. I think subsidies always help. Anything that reduces the price to the customer is good for the customer and obviously good for the carrier that's doing it and good for us as well. And so it's a win across the board. I believe that, at least based on what I see right now, is that there would be probably continuing to have quite a bit of competition in the market, if you're talking about the U.S. market, for customers as the carriers work to get more customers to move to 5G. Outside of... Of the U.S., the subsidies are not used in all geographies. And so it really varies greatly by country. You know, some of them are separate completely, the handset and the service. And in those areas, we don't have subsidies.",3817.826,3889.532,16,2021,1,0.4509999999999999,7.604999999999999,0,-0.073,-1.0509999999999995,1,0.411,8.381,0,0.339,9.404,0,0.7510000000000001,13.904,0,0.886,14.796,0
"Thank you very much. It's amazing how your company has pivoted and progressed through this uncertain time in society. A lot of the pushback we get on our view on Apple is that everyone around them or that they know in developed countries has an iPhone or Apple product, and the market is kind of being saturated some. But when I look at other countries like India, I believe statistically you are materially below that in market share. So are you doing active efforts there? It seems like there's been some news reports of moving supply chain there or you recently opened up an Apple store. How should we think about that? Because it just seems like you're really not full market share equally around the world.","Yeah, there are several markets, as I alluded to before. India is one of those where our share is quite low. It did improve from the year-ago quarter. Our business roughly doubled over that period of time. And so, we feel very good about the trajectory. We are doing a number of things in the area. We put the online store there, for example, and last quarter was the first full quarter of the online store. And that has gotten a great reaction to it and has helped us achieve the results that we got to last quarter. We're also going in there with retail stores in the future. And so, we look for that to be another great initiative, and we continue to develop the channel as well. And so, there's lots of things, not only in India, but in several of the other markets that you might name where our share is lower than we would like. And I, again, I would also say even in the developed markets, when you look at our share, definitely everybody doesn't have an iPhone, not even close. And so, you know, we really don't have a significant share in any market. So there's a headroom left even in those developed markets where you might hear that.",3952.661,4054.73,17,2021,1,0.545,8.15,0,-0.072,-1.122999999999999,0,0.5589999999999999,8.94,0,0.634,10.038,0,0.883,14.787,0,0.97,15.766,0
"Thank you very much. Kim, I had sort of a big picture question on iPhone. I'm just curious, there are so many different things happening this cycle, you know, 5G, pandemic. How are you thinking about the opportunity for, you know, refreshing the installed base and attracting new customers? And, you know, are you seeing lives shortened given some of the, you know, the programs that are being put out there by the carriers and by yourself? Just kind of maybe big picture if you can talk about what you're seeing in terms of, you know, iPhone out there in the market.","Sure, Shannon. We saw double-digit increases on a year-over-year basis on both the new to iPhone and upgraders. So, in fact, in the March quarter, there was actually a record number of upgraders for a March quarter. And so we like what we see. It's obviously the early days of 5G. Different countries are in different points. The penetration is still on a global level, is still low at this point. And so a lot of the 5G upgrades will be in front of us, not behind us. You see in China, things have moved quickly to 5G. They're moving quickly in the United States, but a lot of the other regions are slower to adopt and slower to gain coverage in 5G.",1496.448,1559.161,1,2021,2,0.494,0.494,0,-0.0629999999999999,-0.0629999999999999,0,0.6629999999999999,0.6629999999999999,0,0.937,0.937,0,0.924,0.924,0,0.966,0.966,0
"Okay. And then, Luca, can you talk about gross margin? I mean, 42% is higher than it's been that I can kind of remember, actually, at this point. So, maybe if you talk about the drivers of gross margin, you know, and maybe – if there were any offsets from higher component costs or the logistics costs that obviously were overshadowed by currency and other things.","Yes, Shana. Yes, we did 42.5% during March, and we got it to similar slightly lower levels for June. So for March, we were up 270 basis points sequentially, really driven by three major factors. Cost savings, which have been good for us during this cycle. A really strong mix, a strong mix on iPhone, but in general across all product categories, and that obviously was helpful. And foreign exchange, sequentially, again, from December to March, was favorable 90 basis points, so that helped as well. So those are the three major factors there. As we transition into June, as you know, we will expect some level of deleverage, but that will be offset by cost savings. Foreign exchange doesn't have much of an impact as we go from March to June.",1586.582,1650.214,2,2021,2,0.427,0.921,0,-0.062,-0.1249999999999999,0,0.5860000000000001,1.249,0,0.892,1.829,0,0.914,1.838,0,0.963,1.929,0
"Thank you for taking my question. I have two as well. You know, first one just on services, you know, I think 90 days ago the expectation was that line item would decelerate a little bit into the March quarter. It turned out it actually accelerated for us. I'd love to just understand, you know, what do you think drove that acceleration specifically and, you know, is mid-20% sort of the growth norm as we go forward for services?","So, I mean, our services business did better than what we were expecting when we had the last call in January. It was stronger across the board. One of the things that we've noticed is that, you know, throughout COVID was that obviously digital services have done very well. And then we've had a couple of categories like AppleCare because many of the points of sale and stores were closed. and advertising because of the reduced economic activity that were negatively affected during COVID. During the March quarter, we've seen a return to growth on AppleCare, and obviously we've reopened a lot of the stores during the course of the quarter. And advertising, obviously consumer sentiment has improved, and advertising is coming back. And so the combination of these factors really delivered this very, very strong performance during the March quarter. You know, as we look ahead, as you know, we don't provide specific guidance for our product categories, but in general, I talked during our preparing March, I mean, there are a number of things that we always look at around the services business, you know, how many new paid accounts do we have, What number of new subscriptions do we get? Above all, is our install base continuing to grow? Are we adding new services? Are we improving the quality of the existing services? And so when we look at all these fundamental vectors of our services business, obviously we feel very good. We feel very good about it.",1686.832,1793.851,3,2021,2,0.475,1.396,0,-0.068,-0.1929999999999999,0,0.6759999999999999,1.925,0,0.883,2.712,0,0.928,2.766,0,0.958,2.887,0
"Got it. That's helpful. And then, Tim, if I would follow up with you, you know, it seems like engagement with iPhones and Apple devices generally has gone up materially over the last 12 months. And I don't think replacement cycles, at least in the data we see, has shrunk or changed that much at the end of the day. I'm wondering, does that combination of increased usage, replacement cycles having changed, end up in, you know, iPhones potentially growing on a multi-year basis because I would imagine if I'm using something more, I have to replace it more often. So I'd love your perspective on this.","Yeah, we're clearly seeing strong performance in both the new to iPhone or the switcher component and upgraders, as I've mentioned before. And, in fact, the upgrader was the best March quarter that we've ever had in the And so that speaks to what you're seeing, I think, a lot. It's difficult with just this far into the cycle to make a statement about the cycle in general, because keep in mind that we just launched midway through the Q1 period. And so we've only been operating for, you know, four and a half months or so. But clearly we like what we see right now a lot. If you look at how the iPhone did around the world, we had the top five models of smartphone in the U.S., the top selling, the top two in urban China, four out of the top five in Japan, the top four in the U.K., and the top six in Australia. And so it was a sort of across the board in some really key countries we did really, really well. I do think that the 5G cycle is important, and, you know, we're in the early days of it, frankly.",1827.183,1918.231,4,2021,2,0.517,1.913,0,-0.0689999999999999,-0.2619999999999998,0,0.6709999999999999,2.596,0,0.93,3.642,0,0.7629999999999999,3.529,0,0.972,3.859,0
"This was a pretty unbelievable quarter, and investors are going to ask about the sustainability of current demand trends, especially as you lap some of the benefits from COVID in areas like services and MACs later this year. So I know you don't guide beyond or provide an outlook beyond the next quarter, but can you talk from a high-level perspective? Over the next year, which segments do you see the opportunity to maintain strong revenue growth versus where is it reasonable to assume there will be some digestion as consumers shift their spending priorities? Then I have a follow-up for Luca.","If you sort of look at the different products, iPhone, I've already mentioned some of the great momentum that we had there. Keep in mind that the compare that we're running to would be the quarter, the Q2 of last year, the quarter that China would have entered a shutdown first, and then the rest of the world entered the shutdown in the middle part of March. And so part of the growth is compare, is the comparison point. But that said, the results were fabulous across the board. The shortages that Luca spoke about in the color that he provided on the future affects primarily the iPad and the Mac. And so, we'll have some challenges in there, and challenges meeting the demand that we've got. The demand feels very strong right now. Both on the Mac side, you have the combination of M1 and work from home. and remote learning. And an iPad, you've got remote learning and work from home as well. And the product that we just announced is really killer. The iPad Pro with the M1 in it. And so there's a lot of great things of the strength of the product cycle in addition to the trends that we're seeing in the marketplace. And where this pandemic will end, it seems like many companies will be operating in a hybrid kind of mode and so it would seem that work from home and the productivity of working from home will remain very critical. If you look at wearables then, the watch had a fabulous quarter and I still think we're in the early innings on the watch. The number of new The people that are new to the watch is almost three out of four. And so this is, you know, a long way from being a mature market. And then the services by itself has really accelerated. And so all in all, we feel very, very good.",1974.442,2120.886,5,2021,2,0.552,2.465,0,-0.063,-0.3249999999999998,0,0.6619999999999999,3.258,0,0.93,4.572,0,0.916,4.445,0,0.954,4.813,0
"And then, Luca, if I look at inventory plus vendor non-trade receivables, That grew only about 8% this quarter, which is a big deceleration from last quarter. Should we read into that as a leading indicator for the revenue growth deceleration in the business as the world normalizes? Or were there some supply disruptions during the quarter that caused you to drain inventory and create that tightness that you're talking about for June?","Now, as you think about the June quarter situation, Katie, I would point you to what we said in our prepared remarks around the two factors that will influence our normal seasonality, right? One is the fact that iPhone, we launched iPhone later than usual during this cycle, and so we reached supply-demand balance only during the March quarter, which makes, obviously, the sequential change. decline steeper than usual, and then these $3 or $4 billion of supply constraints that Tim just said, primarily on iPad and Mac. So as you look at your model, and you obviously can look at our numbers that we've done in the past, I think you can try to gauge that. From a channel inventory standpoint, we did what we normally do during a March quarter. So we reduced inventory as it's typical on iPhone. We exited within our target range. So I would say that on the inventory side, it was pretty straightforward. Obviously, given that the supply constraints are on the iPad and the Mac, we wish we had more inventory of iPad and Mac. But this is all a function of high demand for all our products.",2153.044,2242.614,6,2021,2,0.437,2.902,0,-0.077,-0.4019999999999998,0,0.088,3.346,1,0.872,5.444,1,0.914,5.359,0,0.969,5.782,0
"Yes, thank you. Tim, your content offerings are still at very compelling price points and You've seen other content providers, whether it be Spotify, Hulu, Netflix, all announced price increases recently. I'm just wondering how you're thinking about pricing as it pertains to your offering here. And if you could share any stats around the uptake of TV Plus paid subs, that would be great. And I will follow up for Luca.","Let me start with TV Plus. TV Plus is going very well. As you know, the objective and the philosophy that we've had on TV Plus is to create high-quality original content and to be one of the most desired platforms for storytellers. And I see that happening day by day as we sign more shows and more storytellers, including Malala, as I mentioned in my opening comments. To date, we've The Apple Originals have received 352 award nominations and had 98 wins. And, you know, this is from Oscar nominations to Emmy Awards to Critic Choice Awards and all the rest. And we've got some shows that have gotten significant buzz, like Ted Lasso and The Morning Show and Defending Jacob and many others. And so we feel really good about where we are. We're not releasing subscriber numbers, but we feel good about where we are. In terms of other services and pricing, I don't have anything to announce today. We try to give the customer a great value, and we feel that we're doing that with the prices that we've got, and we'll see where we go from here.",2284.216,2373.195,7,2021,2,0.5720000000000001,3.474,0,-0.072,-0.4739999999999998,0,0.632,3.978,0,0.7020000000000001,6.146,0,0.883,6.242,0,0.974,6.756,0
"Okay, thanks, Tim. As my follow-up, Luca, on the June quarter guide, when you talk about the sequential decline being a little bit about perhaps the 13% or low teens percent that we've seen historically, are the supply constraints of the $3-4 billion impact included in that, or is that in addition to sort of the more than average sequential decline that you're referring to? And any color on what specifically is driving the supply constraints at the subcomponent level? Thank you.","So when you look at our normal seasonality, and you mentioned a percentage there that is really an average of several years, what we're saying is that, you know, we believe that the sequential decline this year is going to be higher than that. And it's a combination of the two factors, right? One is the timing of the launch and the very high demand for iPhone during the March quarter and the three to four billion supply constraints that we mentioned. And yeah, and, you know, the constraints come from the semiconductor shortages that are affecting, you know, many, many industries and, you know, And it's a combination of the shortages as well as the very, very high level of demand that we are seeing for both iPad and Mac. For Mac, for example, just to put it into context, the last three quarters of Mac have been the best three quarters ever in the history of the product, right? So we are experiencing an incredible level of demand, which... certainly is favored by the working from home and learning from home environment, but also by the incredible amount of new products and innovation that we put into the products that we launched during the last couple of quarters.",2409.792,2496.337,8,2021,2,0.477,3.951,0,-0.067,-0.5409999999999998,0,0.1519999999999999,4.13,0,0.833,6.979,0,0.897,7.139,0,0.965,7.721,0
"Yeah, thanks for taking the question, and congratulations on a great quarter. I wanted to go back to iPhone. You know, as we think about the iPhone 12 cycle, appreciating that you guys don't give actual shipment numbers, it would appear, though, that the mix has been quite healthy. So I'm wondering if you could give us any context of what in this cycle you're seeing in terms of the mix relative to past cycles. You know, is that mix sustainable? I'm just trying to understand kind of you know, the mix within the iPhones and how that's driving, I guess, particularly gross margin. And I have a follow-up.","Aaron, let me give you a little color on that. The iPhone 12, of the iPhone 12 family, or more broadly, in fact, all iPhones, the iPhone 12 is the most popular. But we did see very strong sales of the Pro portion of the family as well, the Pro plus the Pro Max. And so, the revenue that you're seeing is a function of unit growth and revenue per unit growth. Does that help?",2544.153,2580.563,9,2021,2,0.342,4.293,0,-0.0659999999999999,-0.6069999999999998,0,0.301,4.431,0,-0.243,6.736000000000001,0,0.7290000000000001,7.868,0,0.947,8.668,0
"Yeah, that helps. Can you give any context of how that might have changed this cycle relative to the prior cycles? Have we seen kind of a structural change to the higher band of the product category that you believe can be sustained going forward?","You know, we don't predict going forward other than for our internal use. But we're really happy with the results.",2595.291,2606.853,10,2021,2,0.16,4.453,0,-0.067,-0.6739999999999997,0,0.5329999999999999,4.964,0,-0.162,6.574,0,0.7749999999999999,8.643,0,0.772,9.44,0
"Okay. And then as a quick follow-up, back to the supply constraints, I guess it's hard to kind of see, you know, again, looking forward beyond this quarter, but what's your best assessment of when maybe the supply constraints could ease? Do you have any views of you know, just the industry in general overcoming some of the supply constraint dynamics?","Most of our issue is on legacy nodes. And so on legacy nodes, there are many different people, not only in the same industry, but across other industries that are using legacy nodes. And so in order to really answer that question accurately, We would need to know the true demand from each of these players and how that's going to change over the next few months. And so it's very, very difficult to give you a good answer. I think we have a good handle on our demand. But, you know, what everybody else is doing, I don't know. And so we will do our best. That's what I can tell you.",2628.717,2677.764,11,2021,2,0.4,4.853,0,-0.0719999999999999,-0.7459999999999996,0,0.0969999999999999,5.060999999999999,0,0.2289999999999999,6.803,0,0.752,9.395,0,0.644,10.084,0
"Yeah. Hey, guys. Congratulations on a very nice quarter. Question on semi-supply as well. You just beat by a substantial margin on the top line in the March quarter. I'm curious what went in your favor to be able to secure that kind of supply that you were able to beat by, I think it was $11 million or so, and then I had to follow up?","We did not have a material supply shortage in Q2, and so how were we able to do that? You wind up collapsing all of your buffers and offsets, and that – That happens all the way through the supply chain, and so that enables you to go a bit higher than what we were expecting to sell when we went into the quarter 90 days ago.",2715.198,2746.445,12,2021,2,0.308,5.1610000000000005,0,-0.086,-0.8319999999999996,0,0.261,5.321999999999999,0,0.174,6.977,0,0.864,10.259,0,0.962,11.046,0
"That's very helpful. And then for my follow-up, I know there's a lot of moving parts, Tim, but with the economy sort of reopening here in the U.S., and you mentioned about supply constraints possibly on the Mac and the iPad, I was curious if I could get your thoughts, maybe just color-wise, on what you would expect for those two categories, matching the iPads in the second half of this year.","Well, we don't predict our guide to product-level detail. We're not even guiding to the top level at this point because of COVID. And so I'll sidestep that question, but I would point to Lucas' point earlier about the shortages, and those shortages primarily affect iPad and Mac. So we expect to be supply-gated, not demand-gated.",2772.742,2802.4,13,2021,2,0.309,5.470000000000001,0,-0.0779999999999999,-0.9099999999999996,0,0.043,5.364999999999999,0,0.261,7.238,0,0.679,10.938,0,0.755,11.801,0
"Yeah, thanks for taking my question, and congrats on a fantastic quarter. First question for Tim or Luke. The greater China sales are very strong in the March quarter. Can you give some color on what drove this trend? Which hardware, products, or services enabled the solid outperformance in China? And then add a follow-up.","We were very pleased with our performance in China. We set a March quarter revenue record of and grew strong double digits across each of the product categories. And so the revenue growth was broad. We've been especially pleased by the customer response in China to the iPhone 12 family. And as I mentioned earlier, you have to remember that China entered the shutdown phase earlier in Q2 of last year than other countries. countries, and so they were relatively more affected in that quarter. And that has to be taken into account as you look at the results. As I mentioned earlier, we had the top two selling smartphones in urban China, so we're very proud of that. And, you know, iPad, Mac, both had enormously positive quarters with great strength across the board. And we're seeing a strong reception to the new iPad Pro as well that we just announced. A lot of great comments. And about two-thirds of the people buying Mac and iPad were buying them for the first time. And so we're attracting some new customers in China, which is really important to us.",2835.981,2923.452,14,2021,2,0.517,5.987,0,-0.0689999999999999,-0.9789999999999994,0,0.6809999999999999,6.045999999999999,0,0.88,8.118,0,0.909,11.847,0,0.95,12.751,0
"All right. That is very helpful, Tim. And then maybe as a follow-up, I kind of had like a big-picture philosophical question, and to the extent you can answer this, you know, one of the concerns many investors have is about the overhang of regulatory risks. I understand it's very hard to handicap that, but I'm kind of curious, do you think giving more public disclosure on a services business like App Store or would help alleviate some of those concerns? Do you think that's revealing a lot of competitive details? But kind of curious to know what you think on, you know, services disclosure.","I think with the regulatory questions and scrutiny, we have to make sure that we're telling our story and why we do what we do, and we're very focused on doing that. If we feel that more disclosure would help, we would obviously move in that direction. The App Store and other parts of Apple are not cast in concrete, and so we can move and are flexible with the times. For example, on the App Store, as you know, just a couple of quarters ago, we lowered the – commission rate for small developers to 15%. So that was an example of moving with the times, and we've gotten a great, great reception to that. And so, you know, we continue to learn, and I think it's very important that we're very clear about why we do what we do. The idea behind curating the App Store, in order to get the privacy and security that our customers want, I think is very important, and we have to convey that in a very straightforward manner. Very helpful. Thanks, Tim.",2957.318,3046.744,15,2021,2,0.512,6.4990000000000006,0,-0.068,-1.0469999999999997,0,0.387,6.433,0,0.347,8.465,0,0.5609999999999999,12.408,0,0.919,13.67,0
