tic,year,quarter,timestamp_Q,timestamp_A,timestamp_et_q_start,timestamp_et_q_end,timestamp_et_a_start,timestamp_et_a_end,section,speaker_name_Q,speaker_title_Q,question_text,speaker_name_A,speaker_title_A,answer_text,assertive_label,assertive_score,cautious_label,cautious_score,optimistic_label,optimistic_score,specific_label,specific_score,clear_label,clear_score,relevant_label,relevant_score,sent_section_id,qa_assertive_signed,qa_cautious_signed,qa_optimistic_signed,qa_specific_signed,qa_clear_signed,qa_relevant_signed,qa_assertive_cumulative,qa_cautious_cumulative,qa_optimistic_cumulative,qa_specific_cumulative,qa_clear_cumulative,qa_relevant_cumulative,qa_assertive_sentence_level_CP,qa_cautious_sentence_level_CP,qa_optimistic_sentence_level_CP,qa_specific_sentence_level_CP,qa_clear_sentence_level_CP,qa_relevant_sentence_level_CP
AAPL,2021,2,2544.153,2580.563,2021-04-28 16:41:36.337000-04:00,2021-04-28 16:42:24.153000-04:00,2021-04-28 16:42:24.153000-04:00,2021-04-28 16:43:00.563000-04:00,QA,Aaron Rakers,Wells Fargo,"Yeah, thanks for taking the question, and congratulations on a great quarter. I wanted to go back to iPhone. You know, as we think about the iPhone 12 cycle, appreciating that you guys don't give actual shipment numbers, it would appear, though, that the mix has been quite healthy. So I'm wondering if you could give us any context of what in this cycle you're seeing in terms of the mix relative to past cycles. You know, is that mix sustainable? I'm just trying to understand kind of you know, the mix within the iPhones and how that's driving, I guess, particularly gross margin. And I have a follow-up.",Tim Cook,CEO,"Aaron, let me give you a little color on that. The iPhone 12, of the iPhone 12 family, or more broadly, in fact, all iPhones, the iPhone 12 is the most popular. But we did see very strong sales of the Pro portion of the family as well, the Pro plus the Pro Max. And so, the revenue that you're seeing is a function of unit growth and revenue per unit growth. Does that help?",positive,0.454,neutral,0.708,neutral,0.62,negative,0.416,positive,0.799,positive,0.957,9,0.454,0,0,-0.416,0.799,0.957,5.265,0,4.177,6.826,8.132,8.724,0,0,0,1,0,0
AAPL,2021,2,2595.291,2606.853,2021-04-28 16:43:00.563000-04:00,2021-04-28 16:43:15.291000-04:00,2021-04-28 16:43:15.291000-04:00,2021-04-28 16:43:26.853000-04:00,QA,Aaron Rakers,Wells Fargo,"Yeah, that helps. Can you give any context of how that might have changed this cycle relative to the prior cycles? Have we seen kind of a structural change to the higher band of the product category that you believe can be sustained going forward?",Tim Cook,CEO,"You know, we don't predict going forward other than for our internal use. But we're really happy with the results.",neutral,0.545,neutral,0.739,positive,0.595,neutral,0.78,positive,0.826,positive,0.788,10,0,0,0.595,0,0.826,0.788,5.265,0,4.772,6.826,8.958,9.512,0,0,0,0,0,0
AAPL,2021,2,2628.717,2677.764,2021-04-28 16:43:26.853000-04:00,2021-04-28 16:43:48.717000-04:00,2021-04-28 16:43:48.717000-04:00,2021-04-28 16:44:37.764000-04:00,QA,Aaron Rakers,Wells Fargo,"Okay. And then as a quick follow-up, back to the supply constraints, I guess it's hard to kind of see, you know, again, looking forward beyond this quarter, but what's your best assessment of when maybe the supply constraints could ease? Do you have any views of you know, just the industry in general overcoming some of the supply constraint dynamics?",Tim Cook,CEO,"Most of our issue is on legacy nodes. And so on legacy nodes, there are many different people, not only in the same industry, but across other industries that are using legacy nodes. And so in order to really answer that question accurately, We would need to know the true demand from each of these players and how that's going to change over the next few months. And so it's very, very difficult to give you a good answer. I think we have a good handle on our demand. But, you know, what everybody else is doing, I don't know. And so we will do our best. That's what I can tell you.",positive,0.521,neutral,0.651,neutral,0.814,neutral,0.531,positive,0.811,positive,0.671,11,0.521,0,0,0,0.811,0.671,5.786,0,4.772,6.826,9.769,10.183,0,0,0,0,0,0
AAPL,2021,2,2715.198,2746.445,2021-04-28 16:44:37.764000-04:00,2021-04-28 16:45:15.198000-04:00,2021-04-28 16:45:15.198000-04:00,2021-04-28 16:45:46.445000-04:00,QA,Harsh Kumar,Piper Sandler,"Yeah. Hey, guys. Congratulations on a very nice quarter. Question on semi-supply as well. You just beat by a substantial margin on the top line in the March quarter. I'm curious what went in your favor to be able to secure that kind of supply that you were able to beat by, I think it was $11 million or so, and then I had to follow up?",Tim Cook,CEO,"We did not have a material supply shortage in Q2, and so how were we able to do that? You wind up collapsing all of your buffers and offsets, and that ??That happens all the way through the supply chain, and so that enables you to go a bit higher than what we were expecting to sell when we went into the quarter 90 days ago.",neutral,0.444,neutral,0.681,neutral,0.656,neutral,0.702,positive,0.89,positive,0.97,12,0,0,0,0,0.89,0.97,5.786,0,4.772,6.826,10.659,11.153,0,0,0,0,0,1
AAPL,2021,2,2772.742,2802.4,2021-04-28 16:45:46.445000-04:00,2021-04-28 16:46:12.742000-04:00,2021-04-28 16:46:12.742000-04:00,2021-04-28 16:46:42.400000-04:00,QA,Harsh Kumar,Piper Sandler,"That's very helpful. And then for my follow-up, I know there's a lot of moving parts, Tim, but with the economy sort of reopening here in the U.S., and you mentioned about supply constraints possibly on the Mac and the iPad, I was curious if I could get your thoughts, maybe just color-wise, on what you would expect for those two categories, matching the iPads in the second half of this year.",Tim Cook,CEO,"Well, we don't predict our guide to product-level detail. We're not even guiding to the top level at this point because of COVID. And so I'll sidestep that question, but I would point to Lucas' point earlier about the shortages, and those shortages primarily affect iPad and Mac. So we expect to be supply-gated, not demand-gated.",positive,0.437,neutral,0.666,neutral,0.843,neutral,0.504,positive,0.759,positive,0.781,13,0.437,0,0,0,0.759,0.781,6.223,0,4.772,6.826,11.418,11.934,0,0,0,0,0,0
AAPL,2021,2,2835.981,2923.452,2021-04-28 16:46:42.400000-04:00,2021-04-28 16:47:15.981000-04:00,2021-04-28 16:47:15.981000-04:00,2021-04-28 16:48:43.452000-04:00,QA,Krish Sankar,Cowen & Company,"Yeah, thanks for taking my question, and congrats on a fantastic quarter. First question for Tim or Luke. The greater China sales are very strong in the March quarter. Can you give some color on what drove this trend? Which hardware, products, or services enabled the solid outperformance in China? And then add a follow-up.",Tim Cook,CEO,"We were very pleased with our performance in China. We set a March quarter revenue record of and grew strong double digits across each of the product categories. And so the revenue growth was broad. We've been especially pleased by the customer response in China to the iPhone 12 family. And as I mentioned earlier, you have to remember that China entered the shutdown phase earlier in Q2 of last year than other countries. countries, and so they were relatively more affected in that quarter. And that has to be taken into account as you look at the results. As I mentioned earlier, we had the top two selling smartphones in urban China, so we're very proud of that. And, you know, iPad, Mac, both had enormously positive quarters with great strength across the board. And we're seeing a strong reception to the new iPad Pro as well that we just announced. A lot of great comments. And about two-thirds of the people buying Mac and iPad were buying them for the first time. And so we're attracting some new customers in China, which is really important to us.",positive,0.612,neutral,0.698,positive,0.727,positive,0.911,positive,0.93,positive,0.959,14,0.612,0,0.727,0.911,0.93,0.959,6.835,0,5.499,7.737,12.348,12.893,0,0,0,0,0,0
AAPL,2021,2,2957.318,3046.744,2021-04-28 16:48:43.452000-04:00,2021-04-28 16:49:17.318000-04:00,2021-04-28 16:49:17.318000-04:00,2021-04-28 16:50:46.744000-04:00,QA,Krish Sankar,Cowen & Company,"All right. That is very helpful, Tim. And then maybe as a follow-up, I kind of had like a big-picture philosophical question, and to the extent you can answer this, you know, one of the concerns many investors have is about the overhang of regulatory risks. I understand it's very hard to handicap that, but I'm kind of curious, do you think giving more public disclosure on a services business like App Store or would help alleviate some of those concerns? Do you think that's revealing a lot of competitive details? But kind of curious to know what you think on, you know, services disclosure.",Tim Cook,CEO,"I think with the regulatory questions and scrutiny, we have to make sure that we're telling our story and why we do what we do, and we're very focused on doing that. If we feel that more disclosure would help, we would obviously move in that direction. The App Store and other parts of Apple are not cast in concrete, and so we can move and are flexible with the times. For example, on the App Store, as you know, just a couple of quarters ago, we lowered the ??commission rate for small developers to 15%. So that was an example of moving with the times, and we've gotten a great, great reception to that. And so, you know, we continue to learn, and I think it's very important that we're very clear about why we do what we do. The idea behind curating the App Store, in order to get the privacy and security that our customers want, I think is very important, and we have to convey that in a very straightforward manner. Very helpful. Thanks, Tim.",positive,0.615,neutral,0.621,neutral,0.529,positive,0.611,positive,0.691,positive,0.934,15,0.615,0,0,0.611,0.691,0.934,7.45,0,5.499,8.348,13.039,13.827,0,0,0,0,0,0
AAPL,2021,2,3086.786,3154.838,2021-04-28 16:50:46.744000-04:00,2021-04-28 16:51:26.786000-04:00,2021-04-28 16:51:26.786000-04:00,2021-04-28 16:52:34.838000-04:00,QA,Kyle McNeely,Jefferies,hi thanks a lot for the question uh one of the things we've been positive about is how growing iphone sales can pull long watch and airpods sales as well as customers shop the whole store but you mentioned through covid that accessories do much better in a physical store environment and that's been hard due to the shutdowns obviously so uh my question is have you seen any improvement any attach rate for watch and AirPods with iPhone? And can it get a lot better from here as the environment gets closer to normalization?,Tim Cook,CEO,"I think we get a lot of benefit from our stores when they're open and are fully operational. And, you know, we were in better shape for parts of Q2 than we were previously. But you know, we're still operating with a limited operational model in many stores, and there's still some stores today that are closed, like stores in Michigan and stores in France and so forth. And so I think it will take some amount of time, but my view would be as the stores get back up to speed, fully up to speed, we should be able to increase some of the accessory sales, although I think we're doing fairly well at the moment. So it's not something that we're not doing well. Online has been much more beneficial and much more productive than we would have guessed going into this.",positive,0.597,neutral,0.669,positive,0.689,positive,0.735,positive,0.922,positive,0.95,16,0.597,0,0.689,0.735,0.922,0.95,8.047,0,6.188,9.083,13.961,14.777,0,0,0,0,0,0
AAPL,2021,2,3186.657,3228.288,2021-04-28 16:52:34.838000-04:00,2021-04-28 16:53:06.657000-04:00,2021-04-28 16:53:06.657000-04:00,2021-04-28 16:53:48.288000-04:00,QA,David Voigt,UBS,"Great. Thanks, guys, and congratulations on a good quarter. Maybe if I could just ask a question. I know it's early days, but any commentary, color from maybe the developer community on AT2 and kind of what the initial feedback and data might look like that you could share with us? Thanks.",Tim Cook,CEO,"AT2's focus is really on the user. and giving the user the ability to make a decision about whether they want to be tracked or not. So it's putting the user in the control, not Apple, not another company, but the user of where it should be. And so that's really the focus of it, and the feedback that we've gotten from users both before it went live when it was in the planning stages and so forth and after has been tremendous. And so we're really standing up on behalf of the consumer here.",positive,0.549,neutral,0.743,positive,0.487,positive,0.437,positive,0.884,positive,0.912,17,0.549,0,0.487,0.437,0.884,0.912,8.596,0,6.675,9.52,14.845,15.689,0,0,0,0,0,0
AAPL,2021,2,3246.062,3268.898,2021-04-28 16:53:48.288000-04:00,2021-04-28 16:54:06.062000-04:00,2021-04-28 16:54:06.062000-04:00,2021-04-28 16:54:28.898000-04:00,QA,David Voigt,UBS,"Maybe just as a quick follow-up, Tim, can you kind of discuss, you know, any sort of, you know, what the downloads have looked like? I know it just rolled out earlier this week and sort of the acceptance by the consumer at this point, any sort of metrics that you can share with us, whether it's sort of an opt-in or opt-out sort of view from the consumer perspective?",Tim Cook,CEO,"I don't even know the answer to that. It's not something that we would have predicted beforehand. And frankly, even if it's very low of people that don't want to be tracked, it's worth doing because those people should make their own mind up whether they would like to be tracked or not. Great. Thanks.",neutral,0.477,neutral,0.729,neutral,0.875,neutral,0.489,positive,0.684,positive,0.704,18,0,0,0,0,0.684,0.704,8.596,0,6.675,9.52,15.529,16.393,0,0,0,0,0,0
AAPL,2021,2,3317.397,3427.29,2021-04-28 16:54:28.898000-04:00,2021-04-28 16:55:17.397000-04:00,2021-04-28 16:55:17.397000-04:00,2021-04-28 16:57:07.290000-04:00,QA,Sandy P. Morgan,Morgan Stanley,"Hi, thanks for the question. I have a couple, and just want to get into the performance by geography here a bit, and Europe really exceptional results, particularly for this time of the year. I know you mentioned some of the 5G iPhone upgrades are in front of you, and I would assume Europe's kind of in that category, but curious to hear, or maybe if you can double-click on what's driving the exceptional growth here in Europe, and Are consumers moving to 5G phones even though some of the service provider plans are not rolled out, or are we still expecting that to be much more in front of us?",Luca Maestri,CFO,"Yes, Amik, I'll take that one. You're right. I mean, we had great performance in Europe. We grew 56% during the quarter, and it was probably one of the GEOs where we actually saw you know, results that were better than even our own expectations. We grew very strong double digits across the board, every product category, particularly, I would say, iPad and Mac. You know, they really were very, very strong. Again, obviously, Europe has been affected by lockdowns. More than most parts of the world, the lockdowns have lasted longer. Then here in the United States, for example, Tim was mentioning there are places in Europe still today where our stores are closed. Unfortunately, we have a very strong online business that has really helped us. But working from home, learning from home, you know, limited entertainment options, that has all played in our favor. Keep in mind that our Europe segment is a very broad version of Europe because it includes the Western Europe, which has done very, very well. And then Eastern Europe, and it goes into the Middle East, even India is part of Europe. And those emerging markets have done incredibly well, significantly better than company average. So very, very pleased with some of the results in India, for example, Russia, Middle East in general. So it's been very broad. both across the product categories and across countries in Europe.",positive,0.617,neutral,0.691,positive,0.746,positive,0.929,positive,0.93,positive,0.978,19,0.617,0,0.746,0.929,0.93,0.978,9.213,0,7.421,10.449,16.459,17.371,1,0,1,0,0,0
AAPL,2021,2,3450.629,3558.431,2021-04-28 16:57:07.290000-04:00,2021-04-28 16:57:30.629000-04:00,2021-04-28 16:57:30.629000-04:00,2021-04-28 16:59:18.431000-04:00,QA,Sandy P. Morgan,Morgan Stanley,"And just a quick follow-up for you, Luca. I think overall you just wanted to understand the implication of the investment plans that you announced recently for the U.S., the $430 billion over a multi-year period, getting some questions from investors of how to think about the implication on the run rate of operating expenses for the company.",Luca Maestri,CFO,"If you remember, we announced back in 2018 that we were making a very sizable commitment to the United States. At the time, we announced $350 billion of investment over the following five years. And, you know, during these three years since then, we've overachieved on those commitments and we felt it was the right time to update these type of investments. And they span from, obviously, the investment that we make directly at Apple. For example, you know, we talked about the creation of 20,000 new jobs at Apple over the next five years in the United States. And, of course, our business has grown. And so our commitment, for example, to U.S. suppliers grows over time. And that, you know, shows in the higher numbers. In the meantime... We've got into new businesses, for example, Apple TV+. A lot of the content that we develop for our TV service is produced here in the United States, and so that's additional investment here in the United States. From an OPEX standpoint, I think as you've seen this year, we're getting a lot of leverage. This is one of those years, you know, we said many times, you know, sometimes our OPEX grows faster than revenue. and there are some other cycles where the opposite happens. We are growing revenue this year much faster than our OPEX increase, but we want to continue to make all the necessary investments into the business. We will never underinvest in our business, and so you will continue to see the fact that we will continue to grow our operating expenses, particularly on the R&D side, which continues to be the core of the company.",positive,0.646,neutral,0.643,positive,0.65,positive,0.963,positive,0.941,positive,0.975,20,0.646,0,0.65,0.963,0.941,0.975,9.859,0,8.071,11.412,17.4,18.346,0,0,0,0,0,0
AAPL,2021,3,1497.581,1652.429,2021-07-27 16:24:51.114000-04:00,2021-07-27 16:24:57.581000-04:00,2021-07-27 16:24:57.581000-04:00,2021-07-27 16:27:32.429000-04:00,QA,Chris Casimo,Analyst at Raymond James,"Yes, thank you. Good morning. Just to dig into the commentary on guidance a little bit, just starting with the fact that last year, obviously, there was a later launch of iPhone than we've typically seen in other years. Could you talk us through that and perhaps some of the other products, what may be different as compared to last year?",Luca Maestri,CFO,"Well, as I explained, first of all, we are expecting to grow very strong double digits. That's, I think, Chris, the starting point here. We expect this very strong level of growth that we've experienced during the course of the year to continue into the September quarter. We said that the growth rate is going to be below 36%, and I've listed three factors. The first factor is that The dollar continues to be favorable on a year-over-year basis in the sense that it's weakened against most currencies on a year-over-year basis, but that benefit is going to be about three points less in the September quarter than what we've experienced during the June quarter because the dollar strengthened against most currencies in recent weeks. Second, I mentioned that the services growth rate that we've experienced in the June quarter, 33%, that's significantly higher than what we've had in recent history. And that was due to the fact that there were a couple of services categories, namely our advertising business and AppleCare, that were significantly impacted a year ago because of the COVID lockdowns. And therefore, they had a relatively easy compare in the June quarter. And so we don't expect that to continue into the September quarter. And so we expect significant growth in services, but not to the level that we've seen in June. And then I mentioned that the supply constraints that we've seen in the June quarter will be higher during the September quarter. Back when we talked here three months ago, we said that we were expecting supply constraints for the June quarter between $3 and $4 billion to affect primarily iPad and Mac. We were able to mitigate some of those constraints during the June quarter, and so we came in at a number that was slightly below the low end of that range that we had quoted at the beginning of the quarter. But we expect that number to be higher for the September quarter. And so when you put all that together, again, very strong double-digit growth for September with this caveat that I just mentioned.",positive,0.577,neutral,0.666,positive,0.519,positive,0.975,positive,0.937,positive,0.973,1,0.577,0,0.519,0.975,0.937,0.973,0.577,0,0.519,0.975,0.937,0.973,0,0,0,0,0,0
AAPL,2021,3,1686.501,1749.763,2021-07-27 16:27:32.429000-04:00,2021-07-27 16:28:06.501000-04:00,2021-07-27 16:28:06.501000-04:00,2021-07-27 16:29:09.763000-04:00,QA,Chris Casimo,Analyst at Raymond James,"And thank you. If I could follow up with regard to the supply constraints. And do you expect those supply constraints to persist through the December quarter as well? What effect will that have on the holiday selling season? And then in conjunction with that, what additional costs are you absorbing because of these supply constraints? Is that having an effect on gross margins or just product cost in general as you perhaps pay a little more to get more supply?",Luca Maestri,CFO,"Chris, it's Tim. In terms of the cost, we're paying more for freight than I would like to pay. But component costs continue in the aggregate to decline. In terms of supply constraints and how long they will last, I don't want to predict that today. We're going to take it sort of one quarter at a time. And as you would guess, we'll do everything we can to mitigate whatever set of circumstances we're dealt. And Chris, on the cost side, As I mentioned during my comments, our results for gross margins for the June quarter, 43.3%, we really saw some really nice cost savings during the quarter. And I think you've seen that, you know, we provide a guidance of 41.5 to 42.5 for September, which is obviously a level that we are very pleased with.",positive,0.529,neutral,0.677,neutral,0.467,positive,0.922,positive,0.841,positive,0.96,2,0.529,0,0,0.922,0.841,0.96,1.106,0,0.519,1.897,1.778,1.933,0,0,0,0,0,0
AAPL,2021,3,1809.721,1855.361,2021-07-27 16:29:09.763000-04:00,2021-07-27 16:30:09.721000-04:00,2021-07-27 16:30:09.721000-04:00,2021-07-27 16:30:55.361000-04:00,QA,Jim Suva,Analyst at Citigroup Investment Research,"Thank you very much, and congratulations to you and your global team for great operations during a challenging time. Tim and Luca, I just have one question, and either of you or both of you could figure out who's best to answer it. But we look at a world of pretty unprecedented, whether it be COVID, the Delta variant, China floods, supply chain components. Just wondering for your R&D and innovation, is it being materially impacted by that such where a normal cadence is unfair, or is it kind of happening during a slow time of year where you're able to empower people to work remotely and still have the typical innovations and product launches that you've had historically in the past?",Tim Cook,CEO,"Jim, the company has been incredibly resilient. The employees are... really doing double duty. And I could not be more pleased with the cadence that we're coming out with new things. As you can see from the software announcements that we made at WWDC and the corresponding launches of the software that we plan on in the fall, and then all of the products that we've been able to to bring out over the last 12 to 18 months, it's amazing. And so, I'm very pleased with it.",positive,0.618,neutral,0.668,positive,0.718,neutral,0.434,positive,0.912,positive,0.978,3,0.618,0,0.718,0,0.912,0.978,1.724,0,1.237,1.897,2.69,2.911,0,0,0,0,0,0
AAPL,2021,3,1887.307,1942.158,2021-07-27 16:30:55.361000-04:00,2021-07-27 16:31:27.307000-04:00,2021-07-27 16:31:27.307000-04:00,2021-07-27 16:32:22.158000-04:00,QA,Shannon Cross,Analyst at Cross Research,"Thank you very much. Tim, I'm curious, what have you learned from this iPhone cycle regarding customer preferences and pricing and maybe, you know, subscriptions and that? And if there's a difference, if you could talk about it on a geographic basis. Thanks.",Tim Cook,CEO,"You know, if you look at our results in Q3, Shannon, we had strong double-digit growth for switchers and for upgraders. And in fact, it was our largest upgrade quarter for a Q3 ever. And so we feel really, really great about both categories. And as Luca kind of said during the preamble, our opening comments, our results are really strong for iPhone around the world. And so it's been a very, very strong cycle. And yet the penetration on 5G is obviously still very, very low. And so we feel really good about the future of the iPhone.",positive,0.567,neutral,0.699,positive,0.711,positive,0.843,positive,0.938,positive,0.971,4,0.567,0,0.711,0.843,0.938,0.971,2.291,0,1.948,2.74,3.628,3.882,0,0,0,0,0,0
