Question,Answer,Q_Timestamp,A_Timestamp,QA_Index,year,quarter,assertive_expected_value,assertive_cumulative_tone,assertive_change_point,cautious_expected_value,cautious_cumulative_tone,cautious_change_point,optimistic_expected_value,optimistic_cumulative_tone,optimistic_change_point,specific_expected_value,specific_cumulative_tone,specific_change_point,clear_expected_value,clear_cumulative_tone,clear_change_point,relevant_expected_value,relevant_cumulative_tone,relevant_change_point
hi thanks a lot for the question uh one of the things we've been positive about is how growing iphone sales can pull long watch and airpods sales as well as customers shop the whole store but you mentioned through covid that accessories do much better in a physical store environment and that's been hard due to the shutdowns obviously so uh my question is have you seen any improvement any attach rate for watch and AirPods with iPhone? And can it get a lot better from here as the environment gets closer to normalization?,"I think we get a lot of benefit from our stores when they're open and are fully operational. And, you know, we were in better shape for parts of Q2 than we were previously. But you know, we're still operating with a limited operational model in many stores, and there's still some stores today that are closed, like stores in Michigan and stores in France and so forth. And so I think it will take some amount of time, but my view would be as the stores get back up to speed, fully up to speed, we should be able to increase some of the accessory sales, although I think we're doing fairly well at the moment. So it's not something that we're not doing well. Online has been much more beneficial and much more productive than we would have guessed going into this.",3086.786,3154.838,16,2021,2,0.484,6.9830000000000005,0,-0.065,-1.1119999999999994,0,0.623,7.055999999999999,0,0.659,9.124,0,0.899,13.307,0,0.94,14.61,0
"Great. Thanks, guys, and congratulations on a good quarter. Maybe if I could just ask a question. I know it's early days, but any commentary, color from maybe the developer community on AT2 and kind of what the initial feedback and data might look like that you could share with us? Thanks.","AT2's focus is really on the user. and giving the user the ability to make a decision about whether they want to be tracked or not. So it's putting the user in the control, not Apple, not another company, but the user of where it should be. And so that's really the focus of it, and the feedback that we've gotten from users both before it went live when it was in the planning stages and so forth and after has been tremendous. And so we're really standing up on behalf of the consumer here.",3186.657,3228.288,17,2021,2,0.453,7.436,0,-0.064,-1.1759999999999995,0,0.449,7.504999999999999,0,0.192,9.316,0,0.855,14.162,0,0.9,15.51,0
"Maybe just as a quick follow-up, Tim, can you kind of discuss, you know, any sort of, you know, what the downloads have looked like? I know it just rolled out earlier this week and sort of the acceptance by the consumer at this point, any sort of metrics that you can share with us, whether it's sort of an opt-in or opt-out sort of view from the consumer perspective?","I don't even know the answer to that. It's not something that we would have predicted beforehand. And frankly, even if it's very low of people that don't want to be tracked, it's worth doing because those people should make their own mind up whether they would like to be tracked or not. Great. Thanks.",3246.062,3268.898,18,2021,2,0.257,7.693,0,-0.06,-1.235999999999999,0,0.034,7.539,0,-0.387,8.929,0,0.5660000000000001,14.728,0,0.6499999999999999,16.16,0
"Hi, thanks for the question. I have a couple, and just want to get into the performance by geography here a bit, and Europe really exceptional results, particularly for this time of the year. I know you mentioned some of the 5G iPhone upgrades are in front of you, and I would assume Europe's kind of in that category, but curious to hear, or maybe if you can double-click on what's driving the exceptional growth here in Europe, and Are consumers moving to 5G phones even though some of the service provider plans are not rolled out, or are we still expecting that to be much more in front of us?","Yes, Amik, I'll take that one. You're right. I mean, we had great performance in Europe. We grew 56% during the quarter, and it was probably one of the GEOs where we actually saw you know, results that were better than even our own expectations. We grew very strong double digits across the board, every product category, particularly, I would say, iPad and Mac. You know, they really were very, very strong. Again, obviously, Europe has been affected by lockdowns. More than most parts of the world, the lockdowns have lasted longer. Then here in the United States, for example, Tim was mentioning there are places in Europe still today where our stores are closed. Unfortunately, we have a very strong online business that has really helped us. But working from home, learning from home, you know, limited entertainment options, that has all played in our favor. Keep in mind that our Europe segment is a very broad version of Europe because it includes the Western Europe, which has done very, very well. And then Eastern Europe, and it goes into the Middle East, even India is part of Europe. And those emerging markets have done incredibly well, significantly better than company average. So very, very pleased with some of the results in India, for example, Russia, Middle East in general. So it's been very broad. both across the product categories and across countries in Europe.",3317.397,3427.29,19,2021,2,0.518,8.211,0,-0.068,-1.3039999999999994,0,0.691,8.229999999999999,0,0.907,9.836,0,0.911,15.639,0,0.972,17.131999999999998,0
"And just a quick follow-up for you, Luca. I think overall you just wanted to understand the implication of the investment plans that you announced recently for the U.S., the $430 billion over a multi-year period, getting some questions from investors of how to think about the implication on the run rate of operating expenses for the company.","If you remember, we announced back in 2018 that we were making a very sizable commitment to the United States. At the time, we announced $350 billion of investment over the following five years. And, you know, during these three years since then, we've overachieved on those commitments and we felt it was the right time to update these type of investments. And they span from, obviously, the investment that we make directly at Apple. For example, you know, we talked about the creation of 20,000 new jobs at Apple over the next five years in the United States. And, of course, our business has grown. And so our commitment, for example, to U.S. suppliers grows over time. And that, you know, shows in the higher numbers. In the meantime... We've got into new businesses, for example, Apple TV+. A lot of the content that we develop for our TV service is produced here in the United States, and so that's additional investment here in the United States. From an OPEX standpoint, I think as you've seen this year, we're getting a lot of leverage. This is one of those years, you know, we said many times, you know, sometimes our OPEX grows faster than revenue. and there are some other cycles where the opposite happens. We are growing revenue this year much faster than our OPEX increase, but we want to continue to make all the necessary investments into the business. We will never underinvest in our business, and so you will continue to see the fact that we will continue to grow our operating expenses, particularly on the R&D side, which continues to be the core of the company.",3450.629,3558.431,20,2021,2,0.539,8.75,0,-0.076,-1.3799999999999994,0,0.601,8.831,0,0.947,10.783,0,0.925,16.564,0,0.969,18.101,0
"Yes, thank you. Good morning. Just to dig into the commentary on guidance a little bit, just starting with the fact that last year, obviously, there was a later launch of iPhone than we've typically seen in other years. Could you talk us through that and perhaps some of the other products, what may be different as compared to last year?","Well, as I explained, first of all, we are expecting to grow very strong double digits. That's, I think, Chris, the starting point here. We expect this very strong level of growth that we've experienced during the course of the year to continue into the September quarter. We said that the growth rate is going to be below 36%, and I've listed three factors. The first factor is that The dollar continues to be favorable on a year-over-year basis in the sense that it's weakened against most currencies on a year-over-year basis, but that benefit is going to be about three points less in the September quarter than what we've experienced during the June quarter because the dollar strengthened against most currencies in recent weeks. Second, I mentioned that the services growth rate that we've experienced in the June quarter, 33%, that's significantly higher than what we've had in recent history. And that was due to the fact that there were a couple of services categories, namely our advertising business and AppleCare, that were significantly impacted a year ago because of the COVID lockdowns. And therefore, they had a relatively easy compare in the June quarter. And so we don't expect that to continue into the September quarter. And so we expect significant growth in services, but not to the level that we've seen in June. And then I mentioned that the supply constraints that we've seen in the June quarter will be higher during the September quarter. Back when we talked here three months ago, we said that we were expecting supply constraints for the June quarter between $3 and $4 billion to affect primarily iPad and Mac. We were able to mitigate some of those constraints during the June quarter, and so we came in at a number that was slightly below the low end of that range that we had quoted at the beginning of the quarter. But we expect that number to be higher for the September quarter. And so when you put all that together, again, very strong double-digit growth for September with this caveat that I just mentioned.",1497.581,1652.429,1,2021,3,0.4579999999999999,0.4579999999999999,0,-0.07,-0.07,0,0.42,0.42,0,0.968,0.968,0,0.921,0.921,0,0.966,0.966,0
"And thank you. If I could follow up with regard to the supply constraints. And do you expect those supply constraints to persist through the December quarter as well? What effect will that have on the holiday selling season? And then in conjunction with that, what additional costs are you absorbing because of these supply constraints? Is that having an effect on gross margins or just product cost in general as you perhaps pay a little more to get more supply?","Chris, it's Tim. In terms of the cost, we're paying more for freight than I would like to pay. But component costs continue in the aggregate to decline. In terms of supply constraints and how long they will last, I don't want to predict that today. We're going to take it sort of one quarter at a time. And as you would guess, we'll do everything we can to mitigate whatever set of circumstances we're dealt. And Chris, on the cost side, As I mentioned during my comments, our results for gross margins for the June quarter, 43.3%, we really saw some really nice cost savings during the quarter. And I think you've seen that, you know, we provide a guidance of 41.5 to 42.5 for September, which is obviously a level that we are very pleased with.",1686.501,1749.763,2,2021,3,0.4,0.8579999999999999,0,-0.071,-0.141,0,0.373,0.7929999999999999,0,0.906,1.874,0,0.7889999999999999,1.71,0,0.955,1.921,0
"Thank you very much, and congratulations to you and your global team for great operations during a challenging time. Tim and Luca, I just have one question, and either of you or both of you could figure out who's best to answer it. But we look at a world of pretty unprecedented, whether it be COVID, the Delta variant, China floods, supply chain components. Just wondering for your R&D and innovation, is it being materially impacted by that such where a normal cadence is unfair, or is it kind of happening during a slow time of year where you're able to empower people to work remotely and still have the typical innovations and product launches that you've had historically in the past?","Jim, the company has been incredibly resilient. The employees are... really doing double duty. And I could not be more pleased with the cadence that we're coming out with new things. As you can see from the software announcements that we made at WWDC and the corresponding launches of the software that we plan on in the fall, and then all of the products that we've been able to to bring out over the last 12 to 18 months, it's amazing. And so, I'm very pleased with it.",1809.721,1855.361,3,2021,3,0.527,1.385,0,-0.066,-0.207,0,0.6749999999999999,1.468,0,0.182,2.056,0,0.886,2.596,0,0.974,2.895,0
"Thank you very much. Tim, I'm curious, what have you learned from this iPhone cycle regarding customer preferences and pricing and maybe, you know, subscriptions and that? And if there's a difference, if you could talk about it on a geographic basis. Thanks.","You know, if you look at our results in Q3, Shannon, we had strong double-digit growth for switchers and for upgraders. And in fact, it was our largest upgrade quarter for a Q3 ever. And so we feel really, really great about both categories. And as Luca kind of said during the preamble, our opening comments, our results are really strong for iPhone around the world. And so it's been a very, very strong cycle. And yet the penetration on 5G is obviously still very, very low. And so we feel really good about the future of the iPhone.",1887.307,1942.158,4,2021,3,0.4669999999999999,1.852,0,-0.0689999999999999,-0.2759999999999999,0,0.6639999999999999,2.132,0,0.7899999999999999,2.846,0,0.923,3.519,0,0.963,3.858,0
"Okay. And maybe if you could talk a bit about China, up 58%. Where are you seeing the growth? What are you hearing from customers there? Obviously 58% is not sustainable, but how sustainable is the strength? Thank you.","It was an incredibly strong quarter. It set a June quarter revenue record for Greater China for us, and so we're very proud of that and doing the best job we can to serve customers there. We had a particularly strong response to the 12 Pro and the 12 Pro Max. Those results were particularly strong, but if you look at the balance of our products, We also set June quarter records for wearables, home and accessories for Mac and for services. So it was sort of an across-the-board strength. And we're seeing plenty of new customers come to the market. For example, Mac and iPad, about two-thirds of the customers who bought in the last quarter were new to that product. For the Apple Watch, that number was 85%. And so, you know, we could not be happier with the results.",1960.491,2027.643,5,2021,3,0.544,2.396,0,-0.073,-0.3489999999999998,0,0.6749999999999999,2.807,0,0.936,3.782,0,0.926,4.445,0,0.974,4.832,0
Was the 85% China or overall?,"85% was China. I was talking about specifically the numbers I referenced were specifically for China. And then, Shannon, it's for the world, the watch is 75%. Right.",2032.846,2044.072,6,2021,3,0.073,2.469,0,-0.066,-0.4149999999999999,0,-0.026,2.781,0,0.384,4.166,0,0.755,5.2,0,0.945,5.777,0
"Perfect. Thanks a lot for taking my question. I have two as well. I guess first off, Luca, I was hoping you could maybe talk a little bit more about the gross margins and maybe the expectations you laid out for September. I think sequentially it implies it's down 100 basis points or so. So maybe just touching what are the puts and takes that will be helpful because I think historically September tends to be a flattish, maybe even up a little bit gross margin number people.","Yeah, I think it's important to go back to the Q3 results, right? It's 43.3%. And one of the things that I mentioned is that in addition to getting really good cost savings on a sequential basis, we also had a very high mix of services as part of the total, and particularly with advertising doing really, really well because of the rebound that we saw from the COVID lockdowns a year ago. And so as we move forward sequentially, we do expect a different mix. And so that That drives, you know, the guidance that we provided, which again, as you know, is significantly higher than just a year ago. For example, a year ago, you know, we were at 38.2%, so almost 400 basis points of expansion on a year-over-year basis, right? And so I think it's important to take that into account, just a different mix.",2081.419,2145.178,7,2021,3,0.417,2.886,0,-0.072,-0.4869999999999999,0,0.374,3.155,0,0.851,5.017,0,0.846,6.046,0,0.959,6.736,0
"Got it. No, absolutely. I don't think anyone expected gross margins to be north of 40 this quickly for you folks, so that is impressive. If I could follow up on services, and I know you called out the 33% growth this quarter as a bit of an aberration that compares with easier, but if you look at your services growth rate over the last four quarters, let's just say, what do you think is enabling this growth? Is it you are able to have a higher ARPU, more monetization of your install base, or is your install base green? I'm curious which one's bigger. And then over time, how do you think those two components stack up for you?","It's a combination of multiple factors, right? Obviously, the fact that our install base continues to grow and it sets new all-time highs all the time obviously gives us a larger opportunity all the time. And second, we have more and more people that are engaged in our ecosystem, both transacting for free, which is a very large number, and people that are willing to pay for some of the services. And that percentage of people that are paying for our services continues to grow nicely. I mentioned it grew double digits again this quarter. So that obviously helps on the revenue side. And of course, we continue to increase both the quality and the quantity of the services. You know, as you know, during the last few years, we've launched a lot of new services from Apple TV Plus to Fitness Plus, Apple Arcade, News Plus, and so, and of course the Apple Card. And so these are businesses that we are scaling right now. And so all that additional revenue helps. And I think it flows through our growth rates. As you said, during the last four quarters, you know, we are well into the, you know, mid-20s, right? So, I think it's obviously very nice for us to see.",2183.382,2262.269,8,2021,3,0.562,3.448,0,-0.065,-0.5519999999999999,0,0.626,3.781,0,0.924,5.941,0,0.921,6.9670000000000005,0,0.971,7.707,0
Good afternoon. Can you hear me okay?,"Yes, we can.",2279.199,2280.16,9,2021,3,0.093,3.541,0,-0.052,-0.6039999999999999,0,-0.0059999999999999,3.775,0,-0.1239999999999999,5.817,0,0.4049999999999999,7.372,0,0.597,8.304,0
"Okay, good. First question, there's a debate in the market around how much Apple benefited from the pandemic given increased spend in areas like Mac and App Store. But of course, you've mentioned over the past several quarters that there are other areas that were limited by the pandemic and store closures and less foot traffic. When you net out all the puts and takes, was your business helped or was it hindered by the pandemic?","Well, of course, Katie, we don't have the crystal ball that tells us exactly what these different variables, how they impacted our business. We do know that, I would say, on the positive side of the ledger, obviously, especially during the periods of extreme lockdowns, digital services did very well because entertainment options were limited. And so obviously, our digital services did really, really well. Obviously, with more people working from home, more people studying from home, we know that iPad and Mac demand was very, very strong. On the other side, we had certain services like advertising because of the reduced economic activity, AppleCare because our stores were closed, they were affected negatively. And certain products like the iPhone or the watch that are maybe more complex types of sales because of the complexity of the transaction. They were also affected because so many points of sale were closed all around the world, not only our stores, but also our partner stores. So we had that dynamic throughout COVID. And now some of these businesses are rebounding. I mentioned advertising and AppleCare. iPad and Mac, it's difficult for us to gauge because we've been constrained for quite a long period of time. And the reality is that maybe the new normal after we exit COVID may be different from the past. For example, maybe there's going to be hybrid models around work, for example. And so it's difficult to tell you on a net basis what what that is. Clearly, and this is very fluid because it tends to change over time. I can certainly tell you that we're all looking forward to a COVID-free world. I think that would be very good for us and for the entire, you know, and for our customers as well.",2309.428,2439.411,10,2021,3,0.542,4.083,0,-0.069,-0.6729999999999999,0,0.362,4.137,0,0.839,6.656,0,0.879,8.251,0,0.962,9.266,0
"And just to follow up on iPhones specifically, if you look historically after a really strong product cycle, what which you've experienced this year with iPhone 12. iPhone revenues come under pressure because the upgrade rate slows, the mix often shifts to the lower end of the portfolio. Is it fair to assume a similar trend will play out over the next year? Or if not, what do you think is different this time?","Katie, it's Tim. You know, we're not predicting the next cycle, but I would point out a few things. One is we have a very large and growing install base. As you know, the iPhones passed a billion active devices earlier this year. Two, we have loyal and satisfied customers. The customer set that we're seeing on the new iPhones is just amazing. It's jaw-dropping. And the geographic response is is pervasive across the world. And in the US, we have the top three selling models. In the UK, we have four out of the top five. In Australia, we have the top two. In Japan, we have the top three. In urban China, we have the top two. And so the response from customers all around have been great. Obviously, the product itself is amazing. The 12 lineup was a huge leap that introduced 5G and had A14 Bionic and a number of other fantastic features that customers love. The next thing I think to consider is that we're in the very early innings of 5G. If you look at 5G penetration around the world, there's only a couple of countries that are in the double digits yet. And so that's an amazing thing, nine months or so into this. And the last thing is we're going to continue to deliver great products. We're going to continue to do what we do best is integrate hardware, software, and services together into an amazing experience. And so those are the things that that I would consider if I were coming up with a forecast.",2470.247,2597.803,11,2021,3,0.543,4.626,0,-0.069,-0.7419999999999999,0,0.6519999999999999,4.789,0,0.925,7.581,0,0.906,9.157,0,0.962,10.228,0
"Yeah. Hey, guys. First of all, congratulations. Fantastic execution. It's resulted in consistency for your results. Tim, this is actually perfect timing for this question. You talked about your install base of a billion-odd units. I was curious if you could help us understand how old that install base is. And the reason that I'm asking this question is we're clearly seeing people upgrade to 5G phones. And if that's the case and that continues, that could be a larger force than most other forces are. for your revenues to continue to grow as people migrate to the 5G family of phones. So I was curious if we could shed light on how the upgrades are happening and then also how old that base is.","Yeah, what I would tell you is it's, first of all, it's difficult to answer your question precisely. But what I would tell you is on both switchers and upgraders, we did extremely well in Q3. Both were up strong double digits. And the geographic representation of iPhone year-over-year comps looks extremely well. And so we're really pleased with it. I would remind you that the billion number that I quoted also was iPhone, where we quoted a number earlier in the year in the January call, I believe, of 1.65 billion devices is the total active devices, just for clarification. And so the net is very strong switchers, very strong upgraders, best upgrade quarter for June, for the June quarter that we've seen. And we feel really great about the momentum. But at the same time, we recognize that the 5G penetration is quite low around the world. And, you know, they're very, very low. We're at the front end of this.",2651.381,2736.363,12,2021,3,0.485,5.111,0,-0.073,-0.815,0,0.6849999999999999,5.474,0,0.927,8.508000000000001,0,0.827,9.984,0,0.96,11.188,0
