Question,Answer,Q_Timestamp,A_Timestamp,QA_Index,year,quarter,assertive_expected_value,assertive_cumulative_tone,assertive_change_point,cautious_expected_value,cautious_cumulative_tone,cautious_change_point,optimistic_expected_value,optimistic_cumulative_tone,optimistic_change_point,specific_expected_value,specific_cumulative_tone,specific_change_point,clear_expected_value,clear_cumulative_tone,clear_change_point,relevant_expected_value,relevant_cumulative_tone,relevant_change_point
"Fair enough. For my follow-up, Apple's probably one of the largest semiconductor companies in the world. How does Apple determine what's strategic and something that Apple wants to make itself versus non-strategic And also I was curious, you know, there's a lot of, well, it's public news now that ARM is getting acquired by NVIDIA, and I was curious how Apple views that. Is that something that's beneficial to Apple or not meaningful or negative?","Well, I think that that acquisition has lots of questions that people are asking, and I'll sort of leave that up to everyone else. And in terms of us and how we decide to make silicon, we ask ourselves if we can do something better, if we can deliver a better product, if we can buy something in the market and it's great and it's as good as what we could do, we're going to buy it. we'll only enter where we believe we have an ability to do something better and therefore make a better product for the user. And so the M1 is a great example of that. We have the ability within our silicon team to deliver a product that we feel is appreciably better than we could buy. And so we've taken our great hardware and software expertise and combine those and have brought the M1 out. And the response to the M1 has been unbelievable. You know, it's powering Mac sales that are constrained. It's powering now iPad, which also has constraints on it. And so that's how we look at whether we should enter a market or not.",2768.7,2857.572,13,2021,3,0.5690000000000001,5.68,0,-0.067,-0.8819999999999999,0,0.297,5.771,0,0.5730000000000001,9.081,0,0.903,10.887,0,0.94,12.128,0
"Hi. Thanks for taking my question, and congrats on the strong results. First one for Luca. You mentioned services growth should normalize in the September quarter, and I understand the last few quarters services business was strong, driven by work from home, et cetera. What is the normalized growth rate for the services business as folks return back to the office in this post-COVID world? And then add a follow-up.","Well, I think, you know, you can go back several quarters and try to do a bit of an average. And that's what, you know, we were, you know, talking about. Of course, there's always a bit of variability around results, right? But certainly we haven't done 33% in years. And so... that was a bit of an anomaly. And again, I explained it's around a couple of the businesses that had a relatively easy compare during the June quarter. So, but you know, our, our services growth has been for many, many quarters and, you know, strong double digits. And, and, you know, we feel confident around that level.",2898.04,2937.529,14,2021,3,0.434,6.114,0,-0.072,-0.954,0,0.5840000000000001,6.355,0,0.9,9.981,0,0.904,11.791,0,0.927,13.055,0
"Got it. Got it. And then just to follow up with Tim or Luke, uh, I think, Tim, you mentioned in your prepared comments that in September quarter there's going to be greater impact on supply constraints on the iPhone and iPad. So I'm kind of curious, you know, this is the first time I heard you talk about component shortages impacting the iPhone. Can you be more specific? Is it display drivers or what exactly is the choke point on the supply?","Yeah. The majority of constraints we're seeing are of the variety that I think others are seeing that I would classify as industry shortage. We do have some shortages in addition to that that are where the demand has been so great and so beyond our own expectation that it's difficult to get the entire set of parts within the lead times that We try to get those. And so it's a little bit of that as well. As I said before, and I think probably maybe with the basis of your question, sort of the latest nodes, which we use in several of our products, have not been as much of an issue. The legacy nodes are where the supply constraints have been on silicon.",2964.844,3030.177,15,2021,3,0.37,6.484,0,-0.0689999999999999,-1.0229999999999997,0,0.055,6.41,0,0.628,10.609,0,0.7609999999999999,12.552,0,0.944,13.999,0
"Thanks, Tim.",Yeah.,3031.377,3031.958,16,2021,3,0.1189999999999999,6.603,0,-0.034,-1.0569999999999995,0,0.015,6.425,0,-0.0519999999999999,10.557,0,0.482,13.034,0,0.925,14.924,0
"Great. Thank you guys for the question. So maybe just a point of clarification. So based on the data and the comments about upgraders and switchers being strong as well as emerging markets were relatively strong in the quarter, what does that specific set of data points strength mean for the iPhone portfolio? And I guess my question around that is, you know, when you think about switchers and price points, I think last year you launched the FC2 to really address maybe some of the lower price point markets like the emerging markets. So does that mean thinking about the portfolio going forward, there's less of a need for a lower-priced product going forward and that, you know, the current portfolio and the new cycle going forward would be more high-end in nature as we currently have today? And then I have a follow-up.","Yeah, David, we had an incredible quarter for the emerging markets. In Q3, we set June quarter records in Mexico and Brazil and Chile. in Turkey and UAE and Poland and Czech Republic, India, obviously in China, as I talked about before, Thailand, Malaysia, Vietnam, Cambodia, Indonesia. I could go on and name a few more. It's a very long list. And so those results are for the entire line of products that we have. And keep in mind, we still do have SE in the lines. We launched it a year ago, but it's still in the line today, and it's sort of our entry price point. And so I'm pleased with how all of them are doing, and I think we need sort of that range of price points to accommodate the types of people that we want to accommodate. And so we put something for the entry buyer who really wants to get into an iPhone, and then something for the pro buyer who wants the very best iPhone that they can buy. And I think that's true in the emerging markets as good as it's true in the United States or other developed markets.",3085.847,3175.863,17,2021,3,0.544,7.147,0,-0.0649999999999999,-1.1219999999999997,0,0.598,7.023,0,0.87,11.427,0,0.866,13.9,0,0.971,15.895,0
"No, no, that's helpful. I appreciate that, Ken. So does that mean sort of the emerging market buyer that wants to get into the iPhone, you know, is looking for a device that has 5G capability as well? You know, obviously we're early innings in a lot of markets. Or how do we think about that, you know, over the intermediate to longer term in terms of consumer preference for 5G in those markets, if available from an infrastructure perspective?","In most of the markets I read, it is really, really, really early on 5G. really early. And so I, but I think the top-end buyer is buying for the future as well, because they may hold their phone for two years or longer in some cases. And so 5G becomes an important part of their buying decision.",3198.567,3225.194,18,2021,3,0.342,7.489,0,-0.072,-1.1939999999999995,0,0.095,7.117999999999999,0,0.615,12.042,0,0.8109999999999999,14.711,0,0.97,16.865,0
"Good evening, everyone. Thanks for taking the question. I wanted to start, Luca or Tim, could you walk us through a little bit about how you think Apple I bundles are influencing the trajectory of services and the economics? And then a second part on services, I'm curious how you think IDFA is developing and influencing the trajectory of the advertising business within services.","In terms of Apple One, as you know, we're offering Apple One because it makes enjoying our subscription services easier than ever before, including Apple Music and Apple TV Plus and Apple Arcade and iCloud and more. And so we really put the customer at the center of that and have recently began to remind people about Apple One in a way that we probably waited a few months before doing that. And so I'm very pleased with what we're seeing on Apple One right now and think it's a great ramp for the future services, and more importantly, it's a great customer benefit because many of our customers like to try out more than one of these services and it allows them to do that with one easy bundle and subscription service. In terms of IDFA or the advertising in general, I take it your question is about ATT. With ATT, we've been getting quite a bit of customer reaction, positive reaction to being able to make the decision on a transparent basis about whether to be tracked or not. And it seems to be going very well from a user point of view.",3270.992,3372.477,19,2021,3,0.553,8.042,0,-0.069,-1.2629999999999997,0,0.608,7.726,0,0.768,12.81,0,0.893,15.604,0,0.955,17.82,0
"Yes, thank you. I have two as well. To begin with, Luca, you noted significant product revenue deleverage, but yet your product gross margins were roughly flat. You noted cost savings. Can you maybe talk about whether these are tactical in nature or more structural, like vertical integration that'll continue to drive benefits to product gross margins? And on services side, You noted several times about the strength in ad growth, which is obviously a very high margin contributor, but the sequential trajectory on services margins was flat. So what were some of the offsets there? And I will follow up for Tim.","Yeah. On the product side, I talked about cost savings. Tim mentioned that maybe on the freight side, we're seeing some level of cost pressure that is a bit out of the norm. at this point in the cycle. For everything else, for all the major commodities and components, we continue to see a very typical cycle where we are getting good cost savings on a sequential basis. And so far, it's been very good, as you can tell from the absolute level of gross margins, because on the product side, we're up more than 600 basis points on a year-over-year basis. It feels something that we've been able to accomplish and we were able to maintain, at least in the near term, nothing that was abnormal during the quarter or a one-off in nature. It was pretty structural. On the services side, again, up a lot on a year-over-year basis. So the baseline has gone up a lot. The sequential decline, as you said, it was very, very small. And as I mentioned several times in the past, we have a very large services portfolio with very different margin profiles in our services. And so even a slight change in mix can drive some sequential differences. And this was the case this quarter, just a different mix. I mentioned, for example, that AppleCare has rebounded. And so those, you know, the relative success of our services in the marketplace can drive some something like changes in gross margins. Again, step back for a second, 69.8% gross margin. We're very, very, very happy with where we are with the services margin trajectory.",3425.592,3537.324,20,2021,3,0.507,8.549,0,-0.0679999999999999,-1.3309999999999995,0,0.6469999999999999,8.373,0,0.961,13.771,0,0.923,16.527,0,0.973,18.793,0
"Okay, thanks, Luca. And, Tim, there is increasing regulatory focus in China, in particular, on some of the Chinese companies. It's not a direct impact of Apple, but how should investors handicap the indirect impact, given some of these companies are pretty large contributors to Apple's App Store revenues? And also, are you seeing any impact at all from these? And is the limiting of the usage of some of these apps influencing how people are either interacting with your devices or Or is there any other ancillary impact that you're seeing? Thank you.","Well, for the quarter, as you can see, we grew 58%. So it was a strong quarter. And embedded in that was a quarterly record for services, which includes the App Store. And so we're seeing strength in China. The economy has really bounced back there fairly quickly from COVID. In terms of the regulatory focus, what we are focusing on from our angle is to serve users there and make sure that they're very satisfied with the products and services that we're showing. And we'll you know, we work with a lot of different companies to ensure that. And so that's our focus.",3580.241,3637.22,21,2021,3,0.476,9.025,0,-0.0659999999999999,-1.3969999999999996,0,0.5489999999999999,8.921999999999999,0,0.6649999999999999,14.436,0,0.891,17.418,0,0.951,19.744,0
"Thank you very much. Tim, I'm wondering, can you talk a bit more about specific supply chain issues you saw and how you've seen improvements, I think, during the current quarter, and how we should think about what products you expect to see most impacted going forward? Just any more color you can give us on what's going on out there, because clearly this is hitting everyone.","If you look at Q4 for a moment, we had about $6 billion in supply constraints, and it affected the iPhone, the iPad, and the Mac. There were two causes of them for Q4. One was the chip shortages that you've heard a lot about from many different companies through the industry. And the second was COVID-related manufacturing disruptions in Southeast Asia. The second of those, the COVID disruptions have improved materially across October to where we currently are. And so for this quarter, we think that the primary cause of supply chain related shortages will be the chip shortage. It'll affect It is affecting, I should say, pretty much most of our products currently. But from a demand point of view, demand is very robust. And so, part of this is that demand also is very strong. But we believe that by the time we finish the quarter that the constraints will be larger than the 6 billion that we experienced in Q4.",1531.898,1615.348,1,2021,4,0.4539999999999999,0.4539999999999999,0,-0.07,-0.07,0,0.365,0.365,0,0.778,0.778,0,0.856,0.856,0,0.956,0.956,0
"Okay, great. So you'll sort of push forward in the next quarter as well. Just a different question because I'm curious. You're starting to sell more and more things on a ratable basis. And how are you thinking about that? I mean, you have the new max and we keep seeing you can buy for a monthly charge and that. How do you think that's driving sales and how should we think about percent maybe of the portfolio that's now available? And I don't know if you want to tell us how much revenue is now under under a recurring nature, but it definitely seems as you're shifting more and more to maybe sort of a bundled sale or, you know, offering from a consumer standpoint where you just pay one price every month and you get, you know, all of your Apple devices and Apple services.","Yeah, the first product, Shannon, that really sold on a monthly basis was iPhone. And that began to happen in the U.S. as an example. shortly after the subsidy kind of world changed markedly. And so I would say that predominantly the mode of buying an iPhone in the United States is on a monthly kind of plan today. For the balance of the products, still the most popular would be buying them outright. But we are seeing more and more demand for monthly payments. And so we want to give the customer what they want. And so you will see us do more and more things like that that will meet the customer and provide the price that they want in a way that they want to pay for it. I don't know the percentage of products that are sold that way today, but it is increasing.",1666.741,1733.364,2,2021,4,0.532,0.986,0,-0.071,-0.141,0,0.249,0.614,0,0.7989999999999999,1.577,0,0.847,1.7029999999999998,0,0.971,1.927,0
"Perfect. Thanks a lot, and good afternoon, everyone. I have two as well. You know, I guess when I think about the supply chain headwinds, you talk about $6 billion in September getting bigger in December. Kim, I would love to understand, how do you get comfort that this is really demand that's getting distorted versus potentially getting distorted going somewhere else? And as you think about these supply chain bottlenecks, you know, you wear the CO, you manage a lot of the stuff. Do you feel comfortable this sort of peaks in December and alleviates from there? Or what does that trajectory look like for improvement?","Yeah, what I feel comfortable on is I feel like we've made great progress on the COVID-related disruptions. And that happened across the month of October, and we're in a materially better position today. It is difficult to predict COVID, and so I'm not going to predict where it goes, but I can just tell you that as of today, we're in a materially better position than we were in September and in the first several weeks of October. In terms of the chip shortage, the chip shortage is happening on legacy nodes. Primarily, we buy leading-edge nodes, and we're not having issues on leading-edge nodes. But on legacy nodes, we compete with many different companies for supply, and it's difficult to forecast when those things will balance because you'd have to know how the economy is going to be in 22 and the accuracy of everyone else's demand projections. And so I don't feel comfortable in... in making a prediction. I think it would be, you know, it would be subject to too much inaccuracy. But I do feel very comfortable with our operational team. I think we've got a world-class one, and I'm sure they're doing everything they can do to collapse cycle times and improve yields and do all the things that you can do in addition to fundamental capacity investment to remedy the situation.",1781.355,1881.02,3,2021,4,0.4599999999999999,1.446,0,-0.066,-0.207,0,0.6160000000000001,1.23,0,0.839,2.416,0,0.82,2.523,0,0.966,2.893,0
"Got it. And then, Luca, if I may ask you a question on gross margins for December, you know, you're essentially guiding gross margins to be flat, maybe down a little bit versus what we saw in September. You know, maybe just touch about, I think historically I would have expected gross margins to be up in December given how much revenue leverage you end up with. So maybe what are the puts and takes on gross margins that are resulting in a more flattish guide versus historical seasonality?","Well, as you know, typically, you know, obviously with December being the holiday season, we do get leverage, as you say. But it's also the period of the year where we launch a lot of new products. And as you know, we launch essentially in every product category, we launch new products. Demand is very strong. But as you know, when we launch these new products, we tend to add higher cost structures at the beginning of the cycle. And so that's what balances this out. Obviously, from a year-over-year standpoint, it's actually a significant expansion, right? Because when you look at what we did a year ago in the December quarter, 39.8%, this clearly indicates a significant expansion.",1908.288,1958.288,4,2021,4,0.413,1.859,0,-0.066,-0.273,0,0.182,1.412,0,0.876,3.292,0,0.881,3.404,0,0.964,3.857,0
"Given the supply chain is blurring the demand picture for iPhone 13, what data points can you share that help investors understand whether demand is tracking to a product cycle that is flat, growing, or down from the very strong iPhone 12? And maybe on that front, Luca, you can also comment on where you exited a quarter from a channel inventory standpoint for iPhone relative to a normal product cycle and then have a follow-up?","Yeah, maybe I can take both of those. The channel inventory, as you would expect in a constrained environment, the iPhone channel inventory ended below the targeted range and is currently below it. And so that's that. In terms of the blurring of demand, We look at, Katie, we look at a number of different data points. We look at demand across our online store, demand in retail. We look through to back orders on the carrier channels, the ones that do take back orders there. We look at channel orders as well. And so, we have a number of different data points that we use to conclude how strong demand is. And we feel very, very good about where demand is right now. And we're working feverishly on the supply side of that.",1999.109,2060.334,5,2021,4,0.447,2.306,0,-0.062,-0.335,0,0.6589999999999999,2.071,0,0.624,3.916,0,0.926,4.33,0,0.949,4.806,0
"And Tim, as a follow-up, we've recently surveyed 4,000 consumers in the U.S. and China. And the feedback is most of them don't want to pay for apps or services direct with the developer. They value the security, privacy, ease of transactions with the app store. So, how do you think about balancing the regulator's push for more choice with a customer base that's happy with the existing experience? And just as a follow-on to that, how are you and Luca thinking about the potential impact of services revenue growth rate as some of the changes to the app store go into effect?","Hey, the main thing that we're focused on on the App Store is to keep our focus on privacy and security. And so these are the two major tenets that have produced over the years a very trusted environment where consumers and developers come together and consumers can trust the developers on the developers and the apps or what they say they are, and the developers get a huge benefit audience to sell their software to. And so that's sort of number one on our list. Everything else is a distant second. And so what we're doing is working to explain the decisions that we've made that are key to keeping the privacy and security there, which is to not have sideloading and not have alternate ways on the iPhone where it opens up the iPhone to unreviewed apps and also gets by the privacy restrictions that we put on the App Store. And so we're very, very focused in discussing the privacy and security elements of the App Store with the regulators and legislators.",2103.348,2187.059,6,2021,4,0.5630000000000001,2.869,0,-0.0769999999999999,-0.4119999999999999,0,0.28,2.351,0,0.899,4.815,1,0.897,5.227,0,0.959,5.765,0
"Great. Thank you, guys. And I just have two quick questions. One, big picture theoretical. So, you know, you covered the supply chain in pretty extensive detail on the call, but maybe just a bigger picture on how you're thinking about it philosophically, given what you just sort of went through over the last 12 to 8 months. And what I mean by that is there's sort of a recalibration needed or an adjustment around your supply chain philosophy. either from a partner perspective or maybe a regional perspective? And, you know, how do you think about the current infrastructure and its ability to sort of rebound and sort of handle sort of these disruptions that seem to crop up from time to time? And then I have a follow-up.","Yeah, I don't see a fundamental error that we've made, if that's what you're picking at in terms of creating the environment that we're in. It was created for a number of reasons. The pandemic came along. Some people in the industry and some people outside the industry thought that the pandemic would reduce demand. They pulled their orders down. Things reset. And what really happened was demand went up and went up even more than a straight trend would predict. And so the industry is working through that now. I'm making it a little overly simplistic. There's some other things like yields and things like that that are happening as well. But those things are mainly manageable in the course of time. And so what we're doing is working with our partners on making sure that they have supply that we need and making sure that our demand statements are are accurate as we see them and so forth. And at the same time, we're reducing our lead times and cycle times so that when you get a chip off of FAB, that as quickly as possible, it's in a product and shipping. And also helping the FAB partners increase their yields. And so those things are things that we're doing. We also support the CHIPS Act. and the investment there to put more investment in the ground. And so we're spending some time advocating for the CHIPS Act as well.",2234.387,2351.29,7,2021,4,0.469,3.338,0,-0.069,-0.4809999999999999,0,0.195,2.546,0,0.878,5.693,0,0.88,6.107,0,0.886,6.651,0
