Question,Answer,Q_Timestamp,A_Timestamp,QA_Index,year,quarter,assertive_expected_value,assertive_cumulative_tone,assertive_change_point,cautious_expected_value,cautious_cumulative_tone,cautious_change_point,optimistic_expected_value,optimistic_cumulative_tone,optimistic_change_point,specific_expected_value,specific_cumulative_tone,specific_change_point,clear_expected_value,clear_cumulative_tone,clear_change_point,relevant_expected_value,relevant_cumulative_tone,relevant_change_point
"Hey, George, Scott, good morning. Thanks for taking the questions.","Yeah, good morning.",881.528,883.029,1,2021,1,0.1299999999999999,0.1299999999999999,0,-0.0219999999999999,-0.0219999999999999,0,0.079,0.079,0,0.002,0.002,0,0.514,0.514,0,0.915,0.915,0
"Good morning. Start with, and really solid results, obviously, start with the 17% jump in revenue for Q1 2021. Just how much of that was pricing reflecting pass-through of raw materials and kind of similar question for the increase in revenue guide for the year?","I'd say as a general statement, most of the increase in revenue was really related to increased demand and volume. Pricing started to play a role towards the end of the quarter and will likely play a role along with the raw material increases going forward through the year, but In Q1, it was mostly volume.",900.261,922.918,2,2021,1,0.253,0.3829999999999999,0,-0.058,-0.0799999999999999,0,0.239,0.318,0,0.462,0.464,0,0.899,1.413,0,0.964,1.879,0
"Got it. That's helpful. Scott, I think you said a number for the increase in medical claims for the quarter. I missed it. If you said it, can you repeat it, and what are the expectations kind of on a full year basis?","Medical first quarter year over year is 1.6 million higher. What we're forecasting is kind of a a return to what we would call somewhat normalized. So if you take 2019 and average that with 2020, obviously 2020 was a lot lower due to the COVID restrictions. We're expecting somewhere in the middle there.",936.582,962.285,3,2021,1,0.173,0.5559999999999998,0,-0.065,-0.1449999999999999,0,0.0279999999999999,0.3459999999999999,0,0.881,1.345,0,0.662,2.075,0,0.958,2.837,0
"Got it. Okay. And George gave a lot of great color just in terms of EU demand, obviously remarkably strong and continues to be. You know, just if you had to rank order those factors that you described in terms of what's driving the underlying growth, is it COVID restrictions, you know, is it interest rates remaining low, the efficiency, the standards, you know, or is it just, you know, a combination of all those, just any more color on what's driving that strong demand would be helpful. Okay.","I think, Daniel, what we're seeing is really a balance between the two of the main items. One, the infrastructure is old, and the need to replace windows from the R&R side continues to be there, and the fact that across all of Europe there are some very strict regulations as to energy efficiency requirements when you replace anything on the home. and our products fit very well into that application, better than most. That is a significant benefit and is unrelated to COVID. The COVID piece, as it relates to the restriction on travel, I do think that that's playing a significant piece and will in the near term because I don't see the travel opening up. So across the board, you're seeing people with the discretionary income with the inability to travel and go places or putting money back into their their homes, and we absolutely are seeing a benefit from that. Those are the two main factors.",998.649,1064.945,4,2021,1,0.509,1.065,0,-0.066,-0.2109999999999999,0,0.593,0.9389999999999998,0,0.8009999999999999,2.146,0,0.891,2.966,0,0.909,3.746,0
"Hey, good morning. Hey, I just wanted to ask a follow-up to that last question about the demand drivers in Europe. You know, you called out kind of improved demand consumer demand for renovation because there's less kind of less spend on travel and economic recovery, increasing vaccination rates. But just try to help me think about the differences between what's driving demand in Europe and what's driving demand in North America, because all those things fit the North American profile as well. Right. So I don't know if you can help us think about, you know, what's a key difference between both geographies.","I think they do. I think the big difference between Europe and North America is that in North America, the new construction activity competes with R&R in terms of installation labor, whereas in the U.K. and Europe, it's much more focused on R&R. So, you know, the European growth model is building into that fact. We tend to be heavier weighted to R&R, so in North America, Any resources that go to new construction, I guess comparatively, that's where you'll see the difference.",1113.023,1149.173,5,2021,1,0.4549999999999999,1.5199999999999998,0,-0.065,-0.2759999999999999,0,0.203,1.142,0,0.3379999999999999,2.484,0,0.827,3.793,0,0.889,4.635,0
"Okay. I guess on your cabinet segment, you saw some good margin improvement there, I think 330 basis points. Can you maybe try to quantify the benefits of the new assets, how much that benefited the margin versus volume leverage? And also, when do you anniversary those new assets?","In terms of the asset, you know, it's hard to break it down because plant by plant it gets rolled into general operational improvements. There are three or four assets that we put into our rough mills that are showing yield improvements. So, we haven't split that kind of detail out. So I think it would be inappropriate, and I don't have the proper numbers in front of me to give you that information, Julio. Could you repeat the second part of your question? I apologize.",1171.082,1208.719,6,2021,1,0.225,1.745,0,-0.08,-0.3559999999999999,1,0.009,1.1509999999999998,0,-0.067,2.417,0,0.631,4.424,0,0.537,5.172,0
"Sure. If you benefited from not just volume leverage in this quarter, but also improvement on your manufacturing capabilities, when did you put that in place last year? I'm just trying to think about when you anniversary that.","That was those assets were, were more back half. So we'll, we'll see a full year of benefit probably end of third into our fourth quarter. They were, they were end of year asset installations.",1222.891,1236.704,7,2021,1,0.1779999999999999,1.923,0,-0.071,-0.4269999999999999,0,0.012,1.1629999999999998,0,0.0409999999999999,2.458,0,0.859,5.283,0,0.972,6.144,0
"Okay. And I guess just my last one's a little more broad, just, you know, you called out some, some labor constraints in terms of your company, but yeah, I've always thought about labor constraints is also helping your company right on the, from your customer base because I would think increased labor tightness drives additional demand for your type of product. So if you could speak to that and maybe what you're seeing there.","No, you're absolutely correct. The labor constraints are also a driver of increased share and demand for us. So it's a balance that we're trying to fight and create. As I said, it's not a problem unique to Quantix. So it is creating opportunities. But at the same time, we're fighting availability of labor. As they continue to approve extended unemployment benefits, it is difficult to get labor in almost every market that we're in. And it's the same thing. a simple problem to solve, but you are correctly stating that it is an opportunity for us as well. And we're trying to capitalize on that. We're working hard with our human resources department to put in different programs to be more forward-thinking in terms of attracting labor.",1262.343,1322.553,8,2021,1,0.494,2.417,0,-0.07,-0.4969999999999999,0,0.328,1.491,0,0.226,2.684,0,0.895,6.178,0,0.934,7.078,0
"Hey, good morning. Good morning. I guess I wanted to continue on the labor constraints and maybe more how it impacts you guys. How much did labor constraints maybe, did it reduce sales even though demand was higher for you guys in Q1? And if that was the case, what segments or products are the labor constraints impacting you the most?","So I think where you would see the biggest impact for us is really on our labor costs and significant increases in overtime usage. I don't think, in very rare circumstances, has it impacted a reduction in shipments. The area that... currently is most impacted would probably be our cabinet components plants, primarily up in the Minnesota, Wisconsin area is the toughest market right now.",1365.959,1401.567,9,2021,1,0.305,2.7219999999999995,0,-0.071,-0.568,0,0.0139999999999999,1.5049999999999997,0,-0.038,2.646,0,0.824,7.002,0,0.902,7.98,0
"Okay, great. And then maybe I missed this in the prepared remarks, but how much then is our automation investments a focus right now for CapEx? Maybe it, If there are automation investments being stepped up, is that in North America cabinets or other segments? And then maybe if this is a meaningful portion of the CapEx guide.",CapEx... Automation has been a focus for us for multiple years and it will continue to be so. We have active projects in place to try to reduce labor and ease that burden of our labor demand. The problem that we have and everyone will have in CapEx is that most of the equipment suppliers for automation have long lead times because their demand has increased and they're having the same issues. So we're actively working to implement processes that improve our existing process. But I will tell you that all CAPEX projects are being extended in terms of their timing based on lack of supply and equipment across the globe.,1431.356,1478.837,10,2021,1,0.425,3.147,0,-0.066,-0.6339999999999999,0,0.083,1.588,0,0.761,3.407,0,0.917,7.919,0,0.929,8.909,0
"Good morning, everybody. Maybe if we could talk about the, so we've heard ocean freight and just transportation in general, I guess globally has become increasingly an issue. Are you guys finding that, you know, I know this last year you got some benefit from, from some of the cabinet manufacturers looking to do, you know, in source, production, are you guys finding that to be increasingly a trend in this environment, or is there some other offset that might negate that factor?","No, we still see it as that is a tailwind for us. Internationally sourced freight is The ability to find containers and the surcharges being applied to containers is a significant cost to those that heavily rely on importing a product. So that is an opportunity for us. Our challenge will be, as you know, is we do a very good job of trying to source and supply locally. So it's the inner freight between our plants and trying to minimize the freight costs between us and our customers that we're focused on right now. We don't have a huge impact on the cost side of us from international freight. So that piece is an opportunity. Okay.",1532.272,1586.554,11,2021,1,0.4549999999999999,3.6019999999999994,0,-0.065,-0.699,0,0.412,2.0,0,0.356,3.763,0,0.913,8.832,0,0.954,9.863,0
"And then in North American fenestration, obviously a big quarter there and the outlook is very strong. I mean, is there any way to gauge? I think you guys have been, you know, doing well on the top line with some of your initiatives recently. like screens, for example, but is there any way to gauge, you know, what the, I guess, the market's growing versus how fast you guys are expecting to grow? And then, you know, also, I guess, you know, Windows is one of the things that we've heard is the most constrained product in the industry. Is that leading to an increased backlog for you guys in the coming course? In other words, maybe you would have even had stronger results in Q1 had the industry been able to keep up with the demand?","Let me take the first part of that on the us versus market in North America fenestration. So as you know, we track a few different sources. And Ducker is one that we track for window shipments. And I think their latest forecast showed an expectation of about 6% growth this year. Obviously, with the revised guidance that we just provided, that would indicate that we're growing meaningfully above market. I think, to your point, screens is definitely one of the main drivers there. I'll turn it over to George for the other comment. In terms of the backlog with the Windows customers, You know, I think that this, again, Ruben, goes to the pace setter being installation labor versus new build. From what we're hearing from our customers, demand is strong, backlogs are there, and it's really the installation of windows into the opening holes that's the pace setter for the flow through our industry. So I'm not sure... We could have provided any more windows, and I don't think my customers can make any more. It's really being paced on the installer end.",1631.912,1712.276,12,2021,1,0.516,4.117999999999999,0,-0.067,-0.7659999999999999,0,0.497,2.497,0,0.921,4.683999999999999,0,0.847,9.679,0,0.902,10.765,0
"Okay, and then if I could sneak one more in. Any updates or anything new on the energy efficiency front? I know that you guys, your spacers are efficient and would benefit from any kind of new regulation from the administration. Have you heard or have any updates there?","No, I think it's too early into the new administration. I mean, we anticipate over everything that we're seeing that, you know, it'll be at some point have a renewed focus. You know, we tend to be behind the Europeans in that realm, and we anticipate it'll be addressed, but it hasn't at this point, and we haven't heard anything on the near-term horizon. Great. Thank you, guys, and congrats on the good start to the year.",1733.511,1762.815,13,2021,1,0.248,4.366,0,-0.059,-0.825,0,0.065,2.562,0,-0.0419999999999999,4.642,0,0.7110000000000001,10.39,0,0.589,11.354,0
Your next question is from the line of Ken Zinner of KeyBank.,"Good morning, gentlemen. Good morning, Ken.",1769.428,1774.411,14,2021,1,0.1669999999999999,4.533,0,-0.0659999999999999,-0.8909999999999998,0,0.121,2.683,0,-0.094,4.548,0,0.5,10.89,0,0.528,11.882,0
"Oh, what a quarter. Let's see here. I'm just looking at your January presentation, 55%, thereabouts, North American fenestration. Can you just update us? on the mix of your three businesses there. Is it about a third, a third, a third still, would you say, for IGE screens and profiles?","I think really based on some of the comments we made on screens and accessories, that piece is probably growing to a little bit more than a third. Yeah. IGE is doing well, too. And I would say vinyl is probably on the lower end of the three.",1796.861,1816.989,15,2021,1,0.255,4.787999999999999,0,-0.068,-0.959,0,0.493,3.176,0,0.205,4.753,0,0.708,11.598,0,0.829,12.711,0
"Now, I appreciate that, and it's getting to the actual questions about the quarter and the year, but I ask that because it seems like you're obviously, if the industry is up six, and what was, Doug, you're saying FY20 was up for the industry? Scott, if you have that?","For 21, they were expecting 6% growth. Versus what in FY20, please? Okay.",1833.668,1841.155,16,2021,1,0.0479999999999999,4.835999999999999,0,-0.062,-1.021,0,0.037,3.213,0,0.054,4.807,0,0.619,12.217,0,0.865,13.576,0
"I'm just trying to see, was this share gain, yeah, that's where I'm going.","Yeah, about two, a little over 2% in 20.",1849.078,1852.031,17,2021,1,0.014,4.85,0,-0.061,-1.082,0,-0.0239999999999999,3.189,0,0.413,5.22,0,0.658,12.875,0,0.948,14.524,0
"Right. So would you say the share gains you're seeing in screens is really a function of, you know, your strategy to help manufacturers improve their businesses? Is that Is that a new function that we're seeing in 21, or was that kind of evident in the back half of 20 or 19? Is this a new event is what I'm getting at? Because it's real success you're having, obviously.","Yeah, I would say the success on the screen side is really working with our customers to show the benefit of outsourcing that process and allowing them to focus on using their labor to manufacture and sell windows. The other thing that it's starting to see, and if you remember, we opened up a new plant at the very end of our fiscal 2020, and so we're gaining some growth on an area that was underserved in prior years. That's the two impacts on the screen side.",1882.664,1915.942,18,2021,1,0.474,5.324,0,-0.066,-1.148,0,0.479,3.668,0,0.484,5.704,0,0.924,13.799,0,0.882,15.406,0
"Okay, so when you're saying underserved, just to explore this, because I think about these businesses all different. Underserved, I mean, so you opened up a new plant, and I could Google this, I guess, but you're opening up a plant next to – an existing customer or new customer, basically. So it's actually a greater share of that person's screen business is what I'm assuming you're saying to me.","As we said in the past, the screen product line, and if you look on our investor presentation and see our footprint, the screens are, in terms of weight, very light and they can be easily damaged. So The location of a plant is really based upon a freight radius. We know our optimal radius to be able to ship a screen. So when we locate a new plant, it tends to be around a cluster of customers that we think we have an opportunity to get new business on. And that's why we chose Allentown, PA.",1940.577,1974.736,19,2021,1,0.435,5.759,0,-0.0689999999999999,-1.2169999999999996,0,0.0559999999999999,3.724,0,0.5700000000000001,6.274,0,0.892,14.691,0,0.972,16.378,0
"Excellent. Really appreciate that. So going back to the other piece, if you guys don't mind this question because it Penetration is a fascinating industry. Your profiles, would you say your profile shipments have been in line with the industry growth rate or, you know, or the kind of share gains that we're seeing in your guidance? And related to that, you know, obviously the price pass-through, you know, or are you seeing any disruption there relative to your ability to capture price on the underlying market? Because all that stuff is under contract, right? I mean, it's not a lot of spot. Is it on the accruing side for price?","Yeah, that is correct. I would say in general our growth has been in line with what we're seeing in terms of the market. As we've said in the past, we've been very focused on understanding what we do and do well. So as we've quoted and gone after and retained specific pieces of the business, it's based on SKUs that we feel that we can run effectively. And the other piece that we're doing is we're looking at areas in non-fenestration and it's just starting, but being able to look at other things that use extruded vinyl profiles and utilizing the assets. So we're really, our focus right now is on OEE, keeping the equipment up and running and optimize all runs. to be able to effectively improve profitability. And so that's what we're working on in that area.",2020.989,2075.152,20,2021,1,0.4649999999999999,6.223999999999999,0,-0.0699999999999999,-1.2869999999999997,0,0.222,3.946,0,0.727,7.001,0,0.915,15.606,0,0.884,17.262,0
"And where would you say your capacity is pre having that big shutdown, you know, two or three years ago? Are you running at about 60% of the capacity you did at the peak, you know, three or four years ago?",I would say roughly that's correct.,2088.301,2093.024,21,2021,1,0.114,6.337999999999999,0,-0.072,-1.3589999999999995,0,0.011,3.957,0,-0.0269999999999999,6.974,0,0.7190000000000001,16.325,0,0.955,18.217,0
"Excellent. And then last question, sorry, but The comments from you, consistent with KCMA data, showing cabinet sales up 10% in January, but, you know, semi-custom up 17%, and that's one month, and I'd have to look at the comps and such. But, wow, what a turn. Can you comment as to the 5% growth, if you think that's reasonable enough? Obviously, I think it's reasonable as your guidance, but I mean, do you think there's upside there, or do you have installation constraints like you do in windows, or do you think there could be something bigger there? Because semi-custom homeowners' equity is at a record level. You know, do you think there's – that's a really favorable term for you. That's my last question. Thank you very much, gentlemen.","Thanks, Ken. To answer that question, I think really the biggest pacesetter for us is labor availability, which I talked about. If there is any upside, it will be on any loosening of available labor in the areas where we have our door and our components plants.",2144.815,2163.037,22,2021,1,0.347,6.685,0,-0.0659999999999999,-1.4249999999999996,0,0.466,4.423,0,0.7150000000000001,7.689,0,0.676,17.001,0,0.928,19.145,0
"Yes, thanks again. Most of my follow-ups are covered, but just a quick one. Maybe comment on your proclivity to be more aggressive in terms of buybacks with the remaining 9 million authorizations just given rising EBITDA and strong expected free cash flow and obviously all the gains that you've made on the balance sheet?","Yeah, good question. I think that, to your point, we are operating well. We're putting up good numbers. We did repurchase about $1.9 million in the first quarter. I think the average price was right around $25 or so, which sends a message that we still continue to believe our stock is undervalued even at these levels. So we will be opportunistic with repurchasing stock going forward.",2192.391,2215.924,23,2021,1,0.382,7.066999999999999,0,-0.0819999999999999,-1.5069999999999997,0,0.6489999999999999,5.072,0,0.509,8.198,0,0.868,17.869,0,0.928,20.073,0
That is helpful. Thanks again.,Yep.,2219.345,2220.586,24,2021,1,0.0779999999999999,7.145,0,-0.052,-1.5589999999999995,0,0.012,5.084,0,-0.207,7.991,0,0.4189999999999999,18.288,0,0.6990000000000001,20.772,0
"And at this time, we have no further questions. I will turn it back over to our CEO, George Wilson, for any closing remarks.","Before we sign off, I'd just like to take a brief moment and thank Bob Buck for his service on our board and to Quantix. Bob's contributions over the years were invaluable, and his guidance will be missed as he enters his retirement. I'd like to thank you all for joining the call, and we look forward to providing an update on our next earnings call in June.",2227.988,2250.07,25,2021,1,0.346,7.491,0,-0.06,-1.618999999999999,0,0.361,5.444999999999999,0,-0.071,7.92,0,0.7759999999999999,19.064,0,0.939,21.711,0
"Morning, George. Morning, Scott. Thanks for taking the questions. I'm hoping you can break down or at least directionally give a little bit more detail in terms of price versus quantity as far as the growth is concerned for each of the three segments.","Yeah, that's a tough one to answer. I don't have the data right here in front of me. Volume is definitely the main driver. Pricing in North America is really – push through via contractual pass-throughs for our major raw materials, as you know. And then in Europe, it's the opposite. We don't have contractual pass-throughs there, so it's all priced that we push through to customers. Give me a little time to gather more detail, and we can talk offline.",1127.207,1158.898,1,2021,2,0.327,0.327,0,-0.075,-0.075,0,0.037,0.037,0,0.2299999999999999,0.2299999999999999,0,0.742,0.742,0,0.757,0.757,0
"Fair enough. Obviously, Europe remains exceptionally strong. You know, is it the lack of housing stock that's sort of causing the boom in R&R and qualitatively any commentary and how would you describe your visibility beyond sort of the next two quarters?","I would say right now the underbuilt housing market is the main driver. You couple that with still some restrictions on travel and the increase in discretionary spending income that people have. That has continued to bode well and I don't think that that's going to subside in the short term. So Those two factors are the main driver, and in terms of visibility, outside of the next two quarters, it is limited, but I would say depending on raw material availability and supply issues, the next two quarters look extremely strong, and we're very confident in what we see over the next two quarters.",1180.073,1224.273,2,2021,2,0.361,0.688,0,-0.0709999999999999,-0.1459999999999999,0,0.6259999999999999,0.6629999999999999,0,0.0559999999999999,0.2859999999999998,0,0.825,1.567,0,0.922,1.679,0
"Got it. And similarly in North America, you know, with backlogs for new homes rising to all-time highs, are you benefiting from people choosing to refurbish instead of purchasing a new home to the extent that you have intel there?","I think what we're seeing is exactly that. You know, the availability of new housing starts. I mean, there's just no builders or lack of builders, and the existing – Existing home inventory is at an all-time low. Homes are turning over extremely quick, so there's no inventory. So people that want to do something are being forced into the R&R market, and we absolutely see that, and our customers are seeing it as well. And I think, just to clarify, I think he meant the challenge of getting labor. Oh, in terms of the labor, it's a challenge across the board for every industry, and that's not letting up. I mean... Every aspect of our supply chain is having a hard time getting labor. Our customers are having a hard time getting labor. It's a challenge for us as well. Now, I will tell you that we are cautiously optimistic that, as I mentioned, some of the changes in some of the state unemployment funding levels appear to be repealing and In certain areas, we're starting to see some signs of maybe some relief, but it's still too early to tell, Dan.",1241.295,1316.912,3,2021,2,0.479,1.167,0,-0.066,-0.2119999999999999,0,0.576,1.239,0,0.708,0.9939999999999998,0,0.815,2.382,0,0.952,2.631,0
