Question,Answer,Q_Timestamp,A_Timestamp,QA_Index,year,quarter,assertive_expected_value,assertive_cumulative_tone,assertive_change_point,cautious_expected_value,cautious_cumulative_tone,cautious_change_point,optimistic_expected_value,optimistic_cumulative_tone,optimistic_change_point,specific_expected_value,specific_cumulative_tone,specific_change_point,clear_expected_value,clear_cumulative_tone,clear_change_point,relevant_expected_value,relevant_cumulative_tone,relevant_change_point
"You actually answered my next one as well, so I got two birds with one stone. Lastly, maybe just talk about you added glass to the list, you know, growing list for everybody of supply chain challenges, you know, any incremental color there and, you know, sort of, I assume that that's baked into – are there challenges baked into the guidance, or are you just sort of seeing incremental pressures build? Any color would help.","Sure. So for the glass, it's a relatively new issue, and it's primarily in U.K. and continental Europe. So the glass suppliers, there's two suppliers that have float lines that manufacture the glass that have gone down, and they're on force majeure with – customers on allocation. Now, obviously, we don't buy that, but any of our window and door customers that use glass, it will impact their ability to manufacture. So there's restricted capacity in both the U.K. and Europe for glass. It's mainly a European issue. As it's being relatively new, there's very little of that impact baked into our guidance. What's baked into our guidance is what we're being told now. So the only comment being is if that situation worsens and something else were to happen unexpectedly, that could have an impact. And that is not baked into our guidance.",1350.5,1408.854,4,2021,2,0.3369999999999999,1.504,0,-0.0729999999999999,-0.2849999999999998,0,0.015,1.2539999999999998,0,0.413,1.4069999999999998,0,0.837,3.219,0,0.723,3.354,0
"Hey, good morning. Maybe can you talk to share gain or share shift in any of your segments if it was a contributor to Q2 results or in the guidance?","So as we see, and I won't give you specific numbers, I will give you anecdotally what we see is happening and what has been our selling point in terms of what we bring to the table. As labor continues to be a challenge, in many of our product lines, you know, we have external customers, but some of our customers also are vertically integrated and have the ability to manufacture the same products. As they are looking... to find ways to better increase their output. They're looking at potentially outsourcing non-critical components. And so where we say share gain, in many cases, it's customers deciding to outsource some product. And that's primarily in screens and cabinets is where we'll see the biggest impact of those types of share gains. You can also see that in vinyl, although that's a little more complicated. You still there, Steven? Sounds like we may have lost Steven.",1437.521,1514.345,5,2021,2,0.48,1.984,0,-0.074,-0.3589999999999997,0,0.1629999999999999,1.4169999999999998,0,0.2769999999999999,1.6839999999999995,0,0.886,4.105,0,0.935,4.289,0
"Hey, guys. Okay, sorry, sorry. Quick question, too. if under a scenario of a multi-year, um, strength in the housing market, um, do you foresee a stronger shift, um, kind of beyond the current supply chain challenges to outsourcing that, that would drive results in a pretty strong way over the next, uh, two to three years?","I think what we would see, and we we've stated all along that we we've seen that trend even before COVID, um, You know, as people look to optimize their output, minimize capacity expansion in terms of their footprint, and then also the labor, that trend will continue to challenge. We think it is a big upside, yes.",1546.223,1568.389,6,2021,2,0.373,2.357,0,-0.064,-0.4229999999999998,0,0.5139999999999999,1.931,0,0.299,1.983,0,0.876,4.981,0,0.955,5.244,0
"thank you good morning everybody and congrats on the the quarter guys um maybe just to start on the north american fenestration um strength that you saw you mentioned the the ducker numbers and obviously you guys have the screens business um to i think help you grow above and beyond the market well is it um how do we think about your customers building inventory does that happen at all uh In other words, if they haven't been able to keep up with demand, is there any risk that they've built inventory of your products to be ready for what they expect to see over the next six months or so, or does it not work like that with most of your products?","I think what we're seeing right now, there is really no ability for anyone to build inventory, Ruben, right now because of supply chain pressures. Even if you wanted to build some excess inventory and finish goods or anything, there's just not enough supply or labor to be able to do that. So I'm really doubtful that there's anyone being able to build up significant levels of inventory.",1624.946,1648.846,7,2021,2,0.322,2.679,0,-0.0739999999999999,-0.4969999999999996,0,0.064,1.995,0,-0.088,1.895,0,0.876,5.857,0,0.953,6.197,0
"Okay. And then sort of in a related vein, there's been a lot of talk about, you know, maybe that this level of housing starts the 1.5 to 1.6 or even 1.7 is sort of, you know, the best the market can do in terms of materials and labor in an environment where, you know, the starts level is kind of flattish in 2022 or even in your fiscal 22, do you guys think because of your exposure to R&R, because Windows in particular has been such a tight product category that you'd still be able to grow in that kind of setup because you're still, you know, all the backlog that you've talked about and other initiatives that you have and maybe just touch on initiatives you have to grow above and beyond the market, maybe if there's anything else other than screens that you could elaborate on?","Sure. To answer that, I will answer it in two segments. In terms of our growth expectations on a go-forward basis, and we'll obviously try to give further guidance in future meetings on that, we are very confident in the macroeconomic data points that we see that this cycle does have an extended length of time and even if the new construction side of it were to drop, again, the same fundamentals in R&R that you just mentioned. So we're pretty confident in the outlook in the near to midterm and through our strategic planning period. The other things that we're doing in terms of initiatives, you know, we've been so focused, and we talk about it on return on invested capital, is also finding ways to optimize existing assets that we have, and we're pursuing other markets with some adjacency products. For example, if you were to look at either our rubber extrusion in our spacer business, where we're pursuing other markets for extrusions, as well as vinyl extrusion, where the need for capacity in other people that extrude vinyl is very much out there. So we're becoming a supplier to OEMs in different markets. We're just planting those seeds, so the impact of that on today's numbers are not meaningful, but we believe that there's opportunity to grow potentially different markets organically, and we're working very hard on that.",1700.742,1794.865,8,2021,2,0.485,3.164,0,-0.069,-0.5659999999999997,0,0.5329999999999999,2.528,0,0.8059999999999999,2.701,0,0.939,6.795999999999999,0,0.971,7.168,0
"Great. That's very helpful. And last one for me is, this will probably be a question for Scott, you mentioned some whether it's price cost or difficult comps or what have you, reasons why margin expansion might be tough in the back half. As we move out into the next year, I know it's a little bit early, but just for modeling purposes, do you think that we kind of get past those pressures based on what we know today and you can get back into expanding margins as you grow the business?","Yeah, I think there's some confidence that we'll be able to do that specifically in the North American cabinet component segment, where we've been chasing hardwood costs higher. And at some point, as those stabilizers perhaps come down, we should benefit from a margin perspective. So I think you're right. We should expect that.",1827.915,1849.198,9,2021,2,0.321,3.485,0,-0.076,-0.6419999999999997,0,0.556,3.084,0,-0.33,2.371,0,0.7679999999999999,7.564,0,0.5599999999999999,7.728,0
"Hey, good morning, George. Good morning, Scott. So I wanted to start on the European segment. You saw very strong sales growth in Europe. I know you had the shutdowns in the second quarter of last year. What kind of exit sales growth rate did Europe do in April?","Year over year? It was stronger than the – well, it was about the average of the quarter. We're still doing very well in Europe. if you think about it, April and May of last year, we were shut down some in Europe. So, you know, the year over year. Oh, that's right.",1879.534,1904.581,10,2021,2,0.33,3.815,0,-0.0689999999999999,-0.7109999999999996,0,0.273,3.357,0,0.1,2.471,0,0.886,8.45,0,0.961,8.689,0
"That's right. Yep. Okay. Makes sense. Okay. And maybe can you speak to pricing in Europe? But, you know, I know you don't have contractual press pastors there, but, you know, what's your confidence level there that you can continue to kind of pass through any price in Europe?","You know, the market is so different, and I think the understanding of the OEMs about the cost structure of the products has made it – pricing is never an easy discussion, but when you go with data and transparent and your raw material cost, it's a much more – rational type of discussion with a customer. So I think we're very confident in our ability to continue to get price when needed and with the understanding that when price comes back, you know, we also share at that point too. So, you know, I think we're confident in being able to keep up with inflation and, you know, as long as you show it's not necessarily a margin.",1922.897,1966.278,11,2021,2,0.433,4.248,0,-0.073,-0.7839999999999996,0,0.335,3.692,0,-0.074,2.397,0,0.843,9.293,0,0.906,9.595,0
"Yep. Maybe switching over to the cabinet segment. Can you maybe remind us what the lag is with price increases contractually effective? And when you see that price, is it for hardwood, is it closer to 30 days or 90 days for hardwood?","So the pricing index, the way it works for cabinets, is typically a 90-day lag before it triggers. And there's a certain percentage. So the price has to go up a certain percentage, and then it triggers. And that's usually on a 90-day lag. The part that gets to be an issue is because we're buying from the mills, which tend to have a very short time period for us and everyone else that buys lumber, is you're typically paying in five to ten days. So a net 80-day gap between when you're paying the new price and when you're getting to pass it along to the customer, and then you take into account further escalation of price during that time frame. We're chasing it right now. At some point when that flattens and goes back down, you know, there'll be a benefit to us with the same time periods. But until that happens, we're chasing, and it's pretty significant with the rate of inflation that we see today.",1986.87,2040.118,12,2021,2,0.39,4.638,0,-0.069,-0.8529999999999995,0,0.012,3.704,0,0.924,3.321,0,0.889,10.182,0,0.972,10.567,0
"That makes sense. But since they're contractual, I mean, you know, they're automatically triggered. It's just a matter of the time lag at the moment, the 90-day time lag before they catch up. That is correct. Is that fair? Okay. Yeah. And I guess maybe just my last one here, just sticking with cabinets is, you know, obviously demand is strong. Is there any strategic kind of initiative or components to taking orders, even with, you know, maybe the overtime you might have to pay out? Because the incrementals there you saw this quarter aren't great, right? So I don't know if there's anything strategic to you, maybe taking orders at those incremental margins or, Or is it just pricing catching up, or is it ramping up labor and banking on lower overtime costs once you secure that labor?","I think right now, for us to minimize some of the overtime, and that's the biggest challenge from a margin perspective that's non-index related, we are evaluating capacity expansion and have the potential to add some different capacity in a different region that not only will grow our revenue, but also take pressure off of both interplant freight costs as well as the amount of labor time utilized. And we're working very hard at this point to assess our options on that. But I would think that that's an opportunity in the very near future for us to announce something there.",2090.79,2134.006,13,2021,2,0.368,5.006,0,-0.07,-0.9229999999999996,0,0.1659999999999999,3.87,0,0.305,3.626,0,0.85,11.032,0,0.912,11.479,0
Understood. Thanks for taking the questions.,Thank you.,2137.487,2139.388,14,2021,2,0.09,5.096,0,-0.0619999999999999,-0.9849999999999997,0,0.036,3.906,0,-0.13,3.496,0,0.339,11.371,0,0.305,11.784,0
"So, things are coming back. Lots of demand. In fenestration business, you're actually, you know, all these price indexes. I was trying to look back to see which year you guys didn't have those locked in, and it wasn't – Wasn't good, but obviously spacers and screens, I think are doing quite well. I just want to touch on, you know, as we think about next year, um, which is getting closer and closer, you know, there's an earlier question about, can you have margin expansion? Um, Scott, I think he said, you know, probably cabinets, um, is where you would do that. And, you know, you guys kind of have a 2% margin even target, I think if my recollection for that industry. So that's going to be helpful. As I look at next year, the corporate expense, you know, you're calling out the stock comp and stuff. Can you give us what you think, you know, is kind of a normalized corporate expense rate for the company, you know, either annually or, you know, how should we think about that? Realizing 20 was low, 21 is higher because of stock comp. Like what's in your normalized rate as we think about kind of, you know, next year?","Are you talking about SG&A? Yeah, your corporate expense rate. Yeah. Well, for SG&A, just on the income statement, we guided to about $115 million this year. Our guidance was, I think, $100 million to $105 million. The main driver of the increase now is when we gave the prior guidance, our stock was trading at not even $22, and now we're up closer to $27, $28. So that was a big delta there, along with the more normalized medical expenses that we're seeing now. Also, incentives are also combined in there. So, we're obviously having a good year. So, the incentive accruals are higher. So, on a more normalized basis going forward at Target, I mean, I would assume somewhere between 90 and 100 million on an annual basis for SG&A. Okay.",2221.865,2275.62,15,2021,2,0.38,5.476,0,-0.0669999999999999,-1.0519999999999994,0,0.388,4.294,0,0.951,4.446999999999999,0,0.884,12.255,0,0.96,12.744,0
"Appreciate that. And then, you know, because you just called out cabinets or responded, I guess, when the question was about margin expansion, It w we're obviously, are there issues or ceilings that you're seeing in, you know, the fenestration business, Europe, you know, North America next year, obviously you talked about glass in Europe and I understand that, but is there something, um, you know, in screens, us spacers, you know, extrusion that we should be aware of. That's kind of like ceiling. I mean, you obviously just had really good margin expansion this year. well, it's not over, but it's implied, I guess. Is there something that would keep this year's margin from not going higher in North America fenestrations structurally that you would want to call out or talk about those different businesses? Because it seems like if demand is there, you should still be getting favorable incrementals as well.","Yeah, I mean, that's definitely a possibility. The transparency in this business, as you know, is pretty limited. We're in an inflationary environment right now. If and when that subsides or trends the other way, I mean, we should benefit from a margin perspective as long as volumes stay up because our operating leverage, as we've demonstrated, is pretty good, and we would expect that to continue. And we think the opportunities for continued volume with the product lines that we have, you know, when you can, as you know, with our spacer business, very high efficient, you know, as we continue to identify ways to improve energy efficiency throughout our whole nation, the U.S. tends to be significantly behind Europe. You know, yeah, we think that there's also growth opportunities just on the product line itself because of – uh, where we think that the U S market will ultimately go in terms of pushing energy efficient products.",2342.861,2398.497,16,2021,2,0.4649999999999999,5.941,0,-0.0739999999999999,-1.1259999999999992,1,0.506,4.8,0,0.5670000000000001,5.013999999999999,0,0.901,13.156,0,0.97,13.714,0
"You're right. Understood. And I guess, um, you know, pricing is kind of funny, right? So you got the indexes running through the extrusion stuff and the other businesses, cabinets, you're on this hardwood. Um, so given those lags, I guess it is a reasonable assume you'd your business in total. you know, could grow 20% organic incrementals, except for the fact that when you get price, right, if it covers cost, it's actually, right, margin diluted, which, you know. But is there anything besides that component? Because it seems like your price is, your cost inflation is covered on, let's say, a two-quarter forward basis, right? Your guidance is what it is. But that means we're entering FY22 with your prices covered and volume set to go up, But for that, you cover your price. That's a little margin headwind. Is that really the only thing that causes you guys issues when you think about where next year could go? Because your leverage is low. You're obviously expanding your business, which is great to have capital deployment opportunities. It just seems like it's a pretty constructive base that you're exiting the year at if you've covered your costs.","I think we've been, and by design, we've been very methodical in terms of staying on our roadmap, you know, for the last two to three years. And we've put into place the operational improvements. We've focused on trying to add technology and capacity in certain areas, and we'll continue to do that. I think right now inflation is is the biggest issue that we're, the headwind that we're fighting, and it's the one thing that's the challenge. Without that piece, you know, I think, although we still have opportunities and there's a lot of projects that we're working on, we feel we're positioned fairly well, and we've done a good job of preparing our balance sheet for that point and capitalizing on any opportunity that does come our way. So, you know, the inflation has been a, it's tough for us and everyone else to deal with because it consumes so much energy, but I think, you know, What we've done over the course of the last couple years, I think, has positioned us extremely well, and we're very excited about the opportunities that lie ahead of us.",2473.568,2540.226,17,2021,2,0.429,6.37,0,-0.062,-1.1879999999999993,0,0.362,5.162,0,0.931,5.944999999999999,0,0.872,14.028,0,0.977,14.691,0
"Understood. Thank you very much, gentlemen.",Thank you.,2542.967,2544.448,18,2021,2,0.103,6.473,0,-0.046,-1.233999999999999,0,0.043,5.204999999999999,0,-0.106,5.839,0,0.4179999999999999,14.446,0,0.7050000000000001,15.396,0
"Thank you. This does conclude the question and answer session of today's program. I'd like to hand the program back to George Wilson, CEO, for any further remarks.","We'd like to thank everyone for taking time out and joining us today, and we look forward to providing you all with an update on our next earnings call in early September. Thank you.",2552.952,2563.129,19,2021,2,0.272,6.745,0,-0.067,-1.3009999999999993,0,0.269,5.473999999999999,0,-0.103,5.736,0,0.6960000000000001,15.142,0,0.916,16.312,0
"Thank you, George, Scott. Good morning. Thanks for taking the questions. Morning, Daniel. Maybe talk about you gave some details in terms of key inputs and supply chain constraints. At the margin, are you seeing those abate, about the same, getting worse, and any early indications as far as Hurricane Ida is concerned?","I'll answer this in a couple pieces by product line. In North American fenestration, I think we see the pricing and supply issues continue to remain pretty significant in anything that is chemical related. So anything that derives from any sort of ethylene cracker plant is seeing the continued inflationary pressures. Too early to tell on Hurricane Ida. We know our supply base has not been impacted from a facility standpoint, but still evaluating the whole logistics and the ability to get product shipped through rails, trucks, and ports. So it's still too early to tell. Hardwood pricing, we actually are starting to see some leveling off or down. slight increase, not leveling off, but the rate of inflation appears to be slowing. So we'll continue to look at that and anxiously await that time. And in Europe, things remain about the same.",1049.577,1116.857,1,2021,3,0.357,0.357,0,-0.068,-0.068,0,0.199,0.199,0,0.569,0.569,0,0.881,0.881,0,0.6749999999999999,0.6749999999999999,0
"Excellent. Really helpful. As we look out to fiscal 22, you know, based on price increases you either put in year-to-date or have planned at this time and kind of based on today's pricing, How much of a top-line growth benefit would that translate into next year, just kind of ballpark terms?","You know, we're still evaluating what the 2022 outlook looks like. It becomes a little complicated because our pricing increases are built into a couple. You've got the structural pieces that are built into, you know, selling price. You've also got anything that's surcharge-related. that is really dependent upon where inflation goes. So that revenue number could be impacted negatively if pricing starts to come down. So the revenue number is going to be really hard, and we're not at a point to be able to give you a good forecast at this point. But what we do anticipate is that regardless of what that does, if we start to see some softening in inflation, we do think that that will correspond to improved profitability in 2022. Got it. Helpful.",1138.126,1186.185,2,2021,3,0.3279999999999999,0.6849999999999998,0,-0.062,-0.13,0,0.086,0.285,0,0.854,1.423,0,0.916,1.7970000000000002,0,0.944,1.6189999999999998,0
"And maybe one more, if I might. Leverage all the way down to almost basically zero and generating more cash than you need. You mentioned M&A. Particularly at these levels, would you look to be a little bit more aggressive in terms of share repurchases as well? I know you bought back some stock in the quarter, but any comments there would be helpful. Thanks. Thanks.","You know, I think our current strategy, as we stated, is we're going to continue to focus short-term on paying down debt and then building cash, because we do think that there could be some potential M&A opportunities. Nothing's imminent, but, you know, we are seeing opportunities, and we positioned our balance sheet very well to be able to look at a lot of things that could be accretive. The great thing about where we're at today is, you know, based on our strategic plan, you know, we don't think we need to do anything, and so we're not rushing to grow. We'll look, as I said, to things that enhance our growth profile and are accretive in terms of margin. If those exist, then we are in a very good position to capitalize. In terms of share buyback, we still do believe that we're undervalued. However, there are challenges with the low float that we have. you know, the impact on us on a share buyback, we just think that that's lower in our priority. If the position arises and we feel like it's the best thing to do, we obviously still have enough in the board authorization to purchase stock, but I would rank that lowest on our priority list right now.",1214.476,1282.906,3,2021,3,0.4549999999999999,1.1399999999999997,0,-0.075,-0.205,0,0.334,0.619,0,0.0529999999999999,1.4759999999999998,0,0.875,2.672,0,0.96,2.579,0
Okay. Very helpful. Thanks for the color. I'll jump back and cue the follow-ups. Thanks.,"Thank you, Dan.",1288.407,1289.848,4,2021,3,0.0739999999999999,1.2139999999999995,0,-0.0579999999999999,-0.2629999999999999,0,0.028,0.647,0,-0.32,1.1559999999999997,0,0.314,2.986,0,0.315,2.894,0
"Hey, good morning, George. Good morning, Scott. So I guess on the North American fenestration segment, could you maybe rank order some of the margin challenges there? I know you called out the timing lags for index pricing as well as overtime costs, just looking for a sense of how impactful these two were and if one was more impactful than the other.","You know, I think right now the biggest challenge is on items such as resin and silicone and, again, things that are being driven by feedstock pricing. That's a bigger challenge right now than the labor piece for us short term, at least from a financial perspective.",1320.434,1343.715,5,2021,3,0.239,1.4529999999999996,0,-0.0729999999999999,-0.3359999999999998,0,0.043,0.69,0,-0.048,1.108,0,0.823,3.809,0,0.972,3.866,0
