tic,year,quarter,timestamp_Q,timestamp_A,timestamp_et_q_start,timestamp_et_q_end,timestamp_et_a_start,timestamp_et_a_end,section,speaker_name_Q,speaker_title_Q,question_text,speaker_name_A,speaker_title_A,answer_text,assertive_label,assertive_score,cautious_label,cautious_score,optimistic_label,optimistic_score,specific_label,specific_score,clear_label,clear_score,relevant_label,relevant_score,sent_section_id,qa_assertive_signed,qa_cautious_signed,qa_optimistic_signed,qa_specific_signed,qa_clear_signed,qa_relevant_signed,qa_assertive_cumulative,qa_cautious_cumulative,qa_optimistic_cumulative,qa_specific_cumulative,qa_clear_cumulative,qa_relevant_cumulative,qa_assertive_sentence_level_CP,qa_cautious_sentence_level_CP,qa_optimistic_sentence_level_CP,qa_specific_sentence_level_CP,qa_clear_sentence_level_CP,qa_relevant_sentence_level_CP
PLXS,2021,1,1821.274,1918.446,2021-01-21 09:00:08.948000-05:00,2021-01-21 09:00:21.274000-05:00,2021-01-21 09:00:21.274000-05:00,2021-01-21 09:01:58.446000-05:00,QA,Jim Rusciutti,"Analyst, Needham & Company","Hi. A couple of questions. I was wondering if you might be able to expand on the six new logos you added, if there's any color you can provide either on verticals or type of customer or program.",Steve Frisch,Executive Vice President and Chief Operating Officer,"Yes. So, Jim, this is Todd. I'll get us started, and I'll have Steve provide some of the details around the sectors and the opportunities. But The one thing I wanted to highlight about the new program wins that I think is significant, and I hope that people take away from this, is if you look at our business development approach, it's really to grow with existing customers, to find the right customers and then grow with those customers. And I talked about six new logos, and Steve talked about 14 new relationships. So that includes the six logos plus eight new divisions of existing logos. So when you look at this, we ??We get a new logo in, we transition it, we potentially add additional divisions, and we grow with each of those, the original division or logo as well as the expanded relationship that we have with the other divisions. So I wanted to point that out, and then I want to turn it over to Steve to get into a bit more detail. Sure, Jim. In terms of color, they were equally split across the sector. So there was two in industrials, two in healthcare, life sciences, and two in aerospace. And some of the Wednesday details that I went into highlighted some of them. The anesthesia program that I talked about in healthcare was one of them. The device that's used for advanced manufacturing process control was one of them, as well as the air purification system. And so that gives you a little bit more insight into it was a pretty good mixed across all three of the sectors. Thanks for that color.",positive,0.578,neutral,0.737,neutral,0.607,positive,0.938,positive,0.855,positive,0.973,1,0.578,0.0,0.0,0.938,0.855,0.973,0.578,0.0,0.0,0.938,0.855,0.973,0,0,0,0,0,0
PLXS,2021,1,1962.644,2100.352,2021-01-21 09:01:58.446000-05:00,2021-01-21 09:02:42.644000-05:00,2021-01-21 09:02:42.644000-05:00,2021-01-21 09:05:00.352000-05:00,QA,Jim Rusciutti,"Analyst, Needham & Company","And by the way, I think you gave some good color on how we should be thinking about the second half of the year. But I wanted to go to that target that you're talking about for revenue of 9% to 12% growth. And clearly, last year was impacted unquestionably by COVID. And this year, you've got some moving parts as well. But I'm trying to get a sense What's given you that confidence about that 9% to 12% revenue growth? It sounds like it's the wins that are coming in. It's a question of when do you potentially see that conversion. It's obviously not going to, I think, happen this year.",Todd Kelsey,President and Chief Executive Officer,"Yeah, so I think, Jim, you're right on with your assessment about this year is that the 9 to 12 would be difficult in this year. And kind of the way I've characterized it in the release and in the script here is that if you do the math, it wouldn't add up to the 9 to 12. But there's a number of things that give us confidence that 9 to 12 is a success. a realistic and very achievable goal. And first of all, if we look backward looking over the period of 18 to 20, we were at 10%. So our sectors and our markets have shown that they can support that level of growth. Then if we look, and that includes last year with the pandemic and that number as well, I know as we go through our planning process and we do a bit of a bottoms-up planning, our teams, again, their results support our revenue growth goals. But there's really four factors that I think serve as catalysts for us as we go through fiscal 21 and into fiscal 22. First of all, we have the margin expansion and the sustainable margin expansion, which I think we're doing a nice job of showing that that's very achievable. Second, we've got the recovery of medical equipment used for elective procedures. And we're starting to see a hint of a sign of that right now, but I wouldn't say it's a recovery by any means. So there's great opportunity with that as we move forward. And there's also the increase in demand that we expect to see from commercial aerospace as we see travel upticks post the COVID vaccine rollout. So that may be an early 22 type event is what we're expecting. And then we have the new program ramps. And you saw the win success that we've had, the over billion-dollar trailing four-quarter funnel that we have. We've talked about some of the exciting new programs that have been long-term ramps within our healthcare life sciences sector. These all come to fruition in the F-22 issue. type timeframe here. So we've got a number of catalysts that are looking really good for us as we get beyond or go through fiscal 21 and get into fiscal 22.",positive,0.6,neutral,0.601,positive,0.717,positive,0.978,positive,0.922,positive,0.973,2,0.6,0.0,0.717,0.978,0.922,0.973,1.178,0.0,0.717,1.916,1.7770000000000001,1.946,0,0,1,0,0,0
PLXS,2021,1,2115.128,2136.391,2021-01-21 09:05:00.352000-05:00,2021-01-21 09:05:15.128000-05:00,2021-01-21 09:05:15.128000-05:00,2021-01-21 09:05:36.391000-05:00,QA,Jim Rusciutti,"Analyst, Needham & Company","Got it. Just on commercial air, could you just remind us what that's representing right now of the A&D or maybe just historically what it was? And then I'll jump back in the queue.",Steve Frisch,Executive Vice President and Chief Operating Officer,"Yeah, it's about, let me get the number. I think it's in the mid-30s right now, but I'm going to verify that. It's kind of low 30s is about where it's at right now, and it had been probably a little bit over 40 to even 45 percent at one point. Yeah, that's a plexus of the sector. It's about roughly a third.",neutral,0.538,neutral,0.731,neutral,0.912,positive,0.772,positive,0.763,positive,0.975,3,0.0,0.0,0.0,0.772,0.763,0.975,1.178,0.0,0.717,2.6879999999999997,2.54,2.921,1,0,1,0,0,0
PLXS,2021,1,2189.472,2253.967,2021-01-21 09:05:36.391000-05:00,2021-01-21 09:06:29.472000-05:00,2021-01-21 09:06:29.472000-05:00,2021-01-21 09:07:33.967000-05:00,QA,Adam Tindall,"Analyst, Raymond James","okay thanks good morning and congrats to sean and heather um todd i just wanted to start uh with some questions around the second half comments where revenue is relatively consistent with the fiscal 2q guide just maybe the biggest drivers of why we would see effectively flat sequential trends in q3 and q4 because we normally expect to build up each quarter see it up sequentially on a seasonal basis Sounds like towards the end of the quarter, medical and industrial saw recent strength. You've got new customers coming on. So what would be the offsets that I'm missing to make Q3 and Q4 effectively below normal seasonality?",Todd Kelsey,President and Chief Executive Officer,"Yeah, I think the issue, Adam, is that the visibility is just fairly limited right now. So I would say it's more of a situation as we're just not sure or we just don't know. And if you think back to ??A quarter ago when we had our call, we expected Q2 to be flat to Q1. I mean, obviously it's not. It's up substantially on the order of about $50 million. So we saw a lot of upside demand come in, particularly around the healthcare and in the industrial sector. So as our customers brought up forecasts, they just brought them up in the near term and not necessarily further out. So I'd say there's a lot of uncertainty to us as to whether we're going to see something similar as we move through the rest of the year or whether we won't. But based off of the visibility we have right now, it looks more like flat at this time. But I think in some sense we're a little bit of a victim of our success from an execution standpoint because our customers feel comfortable that they can drop in demand and we'll execute on it.",positive,0.554,neutral,0.642,neutral,0.559,positive,0.902,positive,0.866,positive,0.978,4,0.554,0.0,0.0,0.902,0.866,0.978,1.732,0.0,0.717,3.59,3.406,3.899,0,0,0,0,0,0
PLXS,2021,1,2263.867,2277.458,2021-01-21 09:07:33.967000-05:00,2021-01-21 09:07:43.867000-05:00,2021-01-21 09:07:43.867000-05:00,2021-01-21 09:07:57.458000-05:00,QA,Adam Tindall,"Analyst, Raymond James","Right, that's understandable. And just to clarify, does that also mean that operating margin would kind of stick in that 5% to 5.5% range that was guided to Q2?",Todd Kelsey,President and Chief Executive Officer,"Yeah, it's a bit uncertain. I mean, I think obviously we're targeting to be above the 5% range, but it's a bit uncertain based on the revenue and the leverage that we get. So it's a little too early to call that one.",neutral,0.492,neutral,0.675,neutral,0.823,positive,0.797,positive,0.804,positive,0.974,5,0.0,0.0,0.0,0.797,0.804,0.974,1.732,0.0,0.717,4.3870000000000005,4.21,4.873,0,0,0,0,0,0
PLXS,2021,1,2306.469,2408.35,2021-01-21 09:07:57.458000-05:00,2021-01-21 09:08:26.469000-05:00,2021-01-21 09:08:26.469000-05:00,2021-01-21 09:10:08.350000-05:00,QA,Adam Tindall,"Analyst, Raymond James","Okay. And just maybe a longer-term question. You talked about the record over $3 billion funnel. You talked about committed to the 9% to 12% long-term revenue growth. Just trying to understand, you know, does that imply, you know, potentially a supersized growth year in fiscal 22 such that the average of 21 and 22 can be in the 9% to 12% range? So maybe just help with expectations on timing and magnitude of what seems like a pretty big growth uptick upcoming.",Steve Frisch,Executive Vice President and Chief Operating Officer,"Sure. This is Steve. I'll try to handle that one. Obviously, trying to give guidance up to 22 would be a bit challenging, but looking at the market dynamics of where we're at, which gives us some optimism, is, you know, we look at commercial aerospace and, you know, we're strong in there. We've gained market share. We talked about the fact that we've been bouncing around the bottom and we see this down. And so we see that as a catalyst for growth in terms of what could happen into 22 as things start to recover. We've talked about the elective procedures in healthcare life sciences. We believe we're continuing to take market share. We're winning new logos. And we think there's a catalyst there to help accelerate some growth as things start to recover post-COVID. And then we've talked for the last couple of calls talking about an industrial team in semi-cap and with semiconductor capital equipment. The signals are out there that demand for semiconductor equipment or equipment and devices is only going to increase over time. Looking at our forecast and Todd's comments, we see these flattish kind of forecasts and then we see the short-term drop-ins. I think at some point there's a potential for that to turn into real forecast demand. You know, the optimism of the 9% to 12% is driven by those types of factors combined with the fact that we continue to win decent amounts of new business. And so I think that's why we're optimistic about the growth. Could it outperform? I think if the economy takes off and all these things start to recover post-COVID, you know, I think there's a real chance that demand from our customers continues to increase at a pretty good clip with it.",positive,0.592,neutral,0.677,positive,0.714,positive,0.972,positive,0.927,positive,0.978,6,0.592,0.0,0.714,0.972,0.927,0.978,2.324,0.0,1.431,5.359,5.1370000000000005,5.851,1,0,0,0,0,0
PLXS,2021,1,2444.773,2472.755,2021-01-21 09:10:08.350000-05:00,2021-01-21 09:10:44.773000-05:00,2021-01-21 09:10:44.773000-05:00,2021-01-21 09:11:12.755000-05:00,QA,David Williams,"Analyst, Luke Capital","Great. Thanks for letting me ask the question. And first, congrats to Sean for the transition. First, I wanted to ask maybe about the 2Q demand. And do you think that we're seeing any pull in maybe from some of the second half demands? Or is this mainly just the drop in the early demand or the short-term demand?",Steve Frisch,Executive Vice President and Chief Operating Officer,"Go ahead, Steve. Yeah, I mean, specifically with the Q2 upside, it is upside that's not robbing from future quarters. So our forward-looking quarters have stayed consistent and actually have come up a bit. And so it is upside demand. It's not stealing from future quarters. And as Todd kind of highlighted earlier, You know, one of the things we're looking at is are we going to see this as a trend as we go through Q2, Q3, and Q4? It's just something we're watching.",positive,0.438,neutral,0.709,neutral,0.829,positive,0.562,positive,0.815,positive,0.607,7,0.438,0.0,0.0,0.562,0.815,0.607,2.762,0.0,1.431,5.921,5.952,6.458,0,0,0,0,0,0
PLXS,2021,1,2490.962,2538.132,2021-01-21 09:11:12.755000-05:00,2021-01-21 09:11:30.962000-05:00,2021-01-21 09:11:30.962000-05:00,2021-01-21 09:12:18.132000-05:00,QA,David Williams,"Analyst, Luke Capital","Okay, great. And then just kind of thinking about the COVID-related tailwinds, the shorter-term, the non-sticky. How much of your business, I guess, in the healthcare industry is the shorter-term COVID tailwinds that could potentially fade into next year or the year after?",Todd Kelsey,President and Chief Executive Officer,"Yeah, so... Right now there's not a lot beyond testing and point of care testing that I would call a true COVID tailwind where the demand is up as a result of COVID. Now we see that demand is progressing or continuing at least through calendar 2021 and even our customers are talking about it going beyond that in through 22. And one thing to point out too, I mean we call them COVID testers a lot, but what they are is they're testers that that can be used for COVID, so they can test many other things as well, too. But that's the only thing I would say is a true COVID increase that's in our forecast right now, other than the small amount of upside that Steve talked about on the one critical care product.",positive,0.541,neutral,0.676,neutral,0.662,positive,0.922,positive,0.92,positive,0.978,8,0.541,0.0,0.0,0.922,0.92,0.978,3.303,0.0,1.431,6.843,6.872,7.436,0,0,0,0,0,0
PLXS,2021,1,2550.717,2586.737,2021-01-21 09:12:18.132000-05:00,2021-01-21 09:12:30.717000-05:00,2021-01-21 09:12:30.717000-05:00,2021-01-21 09:13:06.737000-05:00,QA,David Williams,"Analyst, Luke Capital","Great. Thanks for the call. And one last, if I can, real quick, just kind of do any thoughts you might have on the transition from the political landscape, anything that you're watching it, thinking down in terms of positive or positive.",Todd Kelsey,President and Chief Executive Officer,"Yeah, so I mean the one thing we're looking at is on the demand side. I would say there's a few different opportunities that could come up as a result of the proposed stimulus that's out there. We have some heavy equipment business I think some of the COVID products could increase even further from a demand standpoint. Certainly, I think it bodes well for semi-cap as well, too. The other thing we're looking at on the other side of the equation is what happens with the tax landscape, and does that have any impact?",neutral,0.447,neutral,0.683,positive,0.568,neutral,0.609,positive,0.808,positive,0.572,9,0.0,0.0,0.568,0.0,0.808,0.572,3.303,0.0,1.9989999999999999,6.843,7.68,8.008,0,0,0,0,0,1
PLXS,2021,1,2632.222,2764.991,2021-01-21 09:13:06.737000-05:00,2021-01-21 09:13:52.222000-05:00,2021-01-21 09:13:52.222000-05:00,2021-01-21 09:16:04.991000-05:00,QA,Matt Sheeran,"Analyst, Stiefel","Yes, thanks. Just a question regarding the product or the component supply chain environment right now. You talked about inventory days up, Pat. We're hearing across the board of supply constraints in certain semiconductors and some passive components. Are you seeing that yet, and are your customers asking you to build inventory?",Pat Germain,Executive Vice President and Chief Financial Officer,"Yeah, so Matt, this is Steve. I'll take that one. First of all, there's a lot of news out there about the automotive market having shutdowns due to semiconductor shortages. And I just want to remind everybody, we don't do automotive. So in terms of our end market impact, there's nothing there. Specifically, what's causing those challenges in automotive is a tightening in semiconductor components, and we are seeing some of that. We don't foresee any issues here in the fiscal second quarter. From an inventory standpoint, we feel pretty comfortable where we're at. We do start to see lead times start to extend, a little pricing pressure here and there, so it's definitely real from our perspective. I feel actually pretty comfortable. Our teams definitely have to work harder through these periods, but at these times is when our teams have outperformed, and so I'm pretty optimistic in terms of what our teams will be able to do. The one part that I get a little nervous on is looking at those forecasts as we go into the back half of the year. If our customers start dropping in big demand, our ability to react and bring things in is really kind of the bigger challenge. And so we have been talking to our customers about inventory levels and what we're comfortable storing. Now, keep in mind, our customers are responsible for the inventory levels. Plexus doesn't speculate. So from our standpoint, it's really just working through with our customers where they need to be. And we do have some customers that have increased raw component inventories to be able to respond to upside demand in the back half of the year. And so, again, it's a mix with each customer, but we do see it coming a bit more But I think we're responding appropriately. And at this point, the teams are handling it really well. I'm at this, Pat. On the balance sheet, I just want to comment for the second quarter. We do expect a slight build in inventory dollars to the tune of about $20 million. But I had guided the midpoint of our cash cycle being down compared to the fiscal first quarter. And some of that's driven by inventory days just because of the increase in revenue we expect in the second quarter.",positive,0.579,neutral,0.621,positive,0.579,positive,0.783,positive,0.788,positive,0.948,10,0.579,0.0,0.579,0.783,0.788,0.948,3.8819999999999997,0.0,2.578,7.626,8.468,8.956,0,0,0,0,0,1
PLXS,2021,1,2825.745,2913.061,2021-01-21 09:16:04.991000-05:00,2021-01-21 09:17:05.745000-05:00,2021-01-21 09:17:05.745000-05:00,2021-01-21 09:18:33.061000-05:00,QA,Matt Sheeran,"Analyst, Stiefel","Got it. Okay. Thanks for that. And then I did want to follow up on previous questions just regarding your guidance for next quarter and then for the year. As you said, a little bit different than you saw a quarter ago. But when I add the numbers, you know, the revenue, I don't think consensus for fiscal 21 is going to change much. And you're going to be looking at, obviously, tougher comps at the back half when you had a really, really strong last September quarter. But it sounds like the setup for 2022, as Adam indicated, is good. I guess my question is, should we start thinking about a return to that 9% to 11% revenue growth target? And in terms of margins, I know that in the past when you've had some really big ramp-ups quarter to quarter, there's been some costs and some margin headwinds. So how should we think about, you know, growth versus the margin in the mix of the business?",Pat Germain,Executive Vice President and Chief Financial Officer,"Yeah, I think maybe I'll start with 22, and then there's a couple other topics I want to hit as well. But, I mean, certainly too early to talk about 22 and give any sort of, guide or color, but I think it's setting up to be a really good year. When you look at the factors and the catalysts that I talked about earlier, I think that's quite good. And I mean, kind of backing up to 21, I mean, I would say, well, it's not 9 to 12. It still sets up to be a pretty good year or a growth year from a revenue standpoint. But the EPS leverage, I mean, you start to do the math on that, it looks pretty good. So I think that's a compelling story for fiscal 21. And, Matt, you mentioned margin headwinds with transitions. We always have those transitions going on, so I wouldn't say that's necessarily impacting margins. We do have the Thailand facility that's going to be ramping up, and it typically takes a few quarters before a new site reaches corporate averages. And then the other item we're watching is travel expenses. They've been obviously very depressed, and we expect some return at some point, but I don't think we'll get back to the levels we were at pre- COVID. So monitoring that, that could be a slight headwind for us.",positive,0.53,neutral,0.609,positive,0.708,positive,0.964,positive,0.867,positive,0.975,11,0.53,0.0,0.708,0.964,0.867,0.975,4.412,0.0,3.2859999999999996,8.59,9.335,9.931,0,0,0,0,0,0
PLXS,2021,1,2928.796,2979.959,2021-01-21 09:18:33.061000-05:00,2021-01-21 09:18:48.796000-05:00,2021-01-21 09:18:48.796000-05:00,2021-01-21 09:19:39.959000-05:00,QA,Matt Sheeran,"Analyst, Stiefel","Okay, great. And just last quick question, just regarding costs, Pat, you didn't call out a COVID-related cost. Is that just sort of embedded in your model now, or do you see any changes there?",Pat Germain,Executive Vice President and Chief Financial Officer,"um so for the first quarter it was around two million dollars so it's starting to taper down we do expect expenses in the the latter quarters probably to the tune of a million to a million and a half um when you look year over year last year fiscal 20 we had about 10 million dollars this year we would think that's about six million dollars so about four million dollars lower there um on another area of cost are healthcare costs internal. We're depressed with last year with elective procedures being down. We expect those to be up. And that pretty much offsets the benefit we're seeing from a COVID expense reduction. We expect healthcare costs to be up about $4 million this year. So net-net, those are pretty flat.",positive,0.46,neutral,0.698,neutral,0.649,positive,0.949,positive,0.88,positive,0.968,12,0.46,0.0,0.0,0.949,0.88,0.968,4.872,0.0,3.2859999999999996,9.539,10.215,10.899,0,0,0,0,0,0
PLXS,2021,1,2982.54,2983.641,2021-01-21 09:19:39.959000-05:00,2021-01-21 09:19:42.540000-05:00,2021-01-21 09:19:42.540000-05:00,2021-01-21 09:19:43.641000-05:00,QA,Matt Sheeran,"Analyst, Stiefel","Okay, that's helpful. Okay, thanks a lot.",Pat Germain,Executive Vice President and Chief Financial Officer,Sure.,neutral,0.563,neutral,0.743,neutral,0.904,neutral,0.725,positive,0.563,positive,0.663,13,0.0,0.0,0.0,0.0,0.563,0.663,4.872,0.0,3.2859999999999996,9.539,10.778,11.562,0,0,0,0,1,0
PLXS,2021,1,3013.372,3036.189,2021-01-21 09:19:43.641000-05:00,2021-01-21 09:20:13.372000-05:00,2021-01-21 09:20:13.372000-05:00,2021-01-21 09:20:36.189000-05:00,QA,Stephen Potts,"Analyst, Potts Advisors","Thanks. Just two questions for me, if I could. First one on the funnel expansion. You mentioned some decisions by some customers to move to outsourcing. Could you expand on what drove that decision, whether it was something that was already in the works or maybe if there was a change in thinking due to circumstances? And then I had a follow-up.",Steve Frisch,Executive Vice President and Chief Operating Officer,"Yeah, this is Steve. In some of these challenging times, I think customers do question their supply chain strategies more, and so I think the conversations we're having right now are things that customers were considering, but I think the COVID situation is pushing them to move a little bit quicker. So not a big strategic shift on ??I mean, a big strategic shift on their part, but I think the timing of COVID is just helping expedite things.",positive,0.483,neutral,0.662,neutral,0.716,neutral,0.525,positive,0.768,positive,0.753,14,0.483,0.0,0.0,0.0,0.768,0.753,5.3549999999999995,0.0,3.2859999999999996,9.539,11.546,12.315,0,0,0,0,0,0
