tic,year,quarter,timestamp_Q,timestamp_A,timestamp_et_q_start,timestamp_et_q_end,timestamp_et_a_start,timestamp_et_a_end,section,speaker_name_Q,speaker_title_Q,question_text,speaker_name_A,speaker_title_A,answer_text,assertive_label,assertive_score,cautious_label,cautious_score,optimistic_label,optimistic_score,specific_label,specific_score,clear_label,clear_score,relevant_label,relevant_score,sent_section_id,qa_assertive_signed,qa_cautious_signed,qa_optimistic_signed,qa_specific_signed,qa_clear_signed,qa_relevant_signed,qa_assertive_cumulative,qa_cautious_cumulative,qa_optimistic_cumulative,qa_specific_cumulative,qa_clear_cumulative,qa_relevant_cumulative,qa_assertive_sentence_level_CP,qa_cautious_sentence_level_CP,qa_optimistic_sentence_level_CP,qa_specific_sentence_level_CP,qa_clear_sentence_level_CP,qa_relevant_sentence_level_CP
PLXS,2021,1,3052.925,3076.654,2021-01-21 09:20:36.189000-05:00,2021-01-21 09:20:52.925000-05:00,2021-01-21 09:20:52.925000-05:00,2021-01-21 09:21:16.654000-05:00,QA,Stephen Potts,"Analyst, Potts Advisors","And those shifts would be done with, like, Their current facilities would be utilized by the customer. You'd be outsourcing into your existing facilities, like their strategy around their own plant and equipment is what?",Steve Frisch,Executive Vice President and Chief Operating Officer,"Yes, they would exit their facilities, and we would do that one of two ways. One is either to just move the facility entirely at the moment that they exit it or do what we call a manage in place is where we'd manage it for 18 months, 24 months, and then transfer it. Under a rare circumstance, if there's a strategic alignment, would we consider a facility? Yes, but that would be under a very strategic decision.",positive,0.484,neutral,0.683,neutral,0.906,neutral,0.589,positive,0.914,positive,0.85,15,0.484,0.0,0.0,0.0,0.914,0.85,5.8389999999999995,0.0,3.2859999999999996,9.539,12.46,13.165,0,0,0,0,0,0
PLXS,2021,1,3097.337,3120.843,2021-01-21 09:21:16.654000-05:00,2021-01-21 09:21:37.337000-05:00,2021-01-21 09:21:37.337000-05:00,2021-01-21 09:22:00.843000-05:00,QA,Stephen Potts,"Analyst, Potts Advisors","And then just on the new logo wins, can you just talk about the competitive environment around those six wins, how much of it was due to just sort of where you guys play versus maybe seeing competition from small or large teams? EMS providers?",Steve Frisch,Executive Vice President and Chief Operating Officer,"Yeah, the competitive environment is about the same. I mean, we run into the big guys all the time, and there's always smaller players involved as well. And so I don't think with these situations or with COVID, there's been a big fundamental shift in the competitive landscape. Although we are seeing a little bit more, I'd say, pricing diligence and a little bit discipline. And so that's refreshing to see.",positive,0.507,neutral,0.672,neutral,0.773,neutral,0.447,positive,0.814,positive,0.905,16,0.507,0.0,0.0,0.0,0.814,0.905,6.346,0.0,3.2859999999999996,9.539,13.274000000000001,14.07,0,0,0,0,0,0
PLXS,2021,1,3156.575,3218.006,2021-01-21 09:22:00.843000-05:00,2021-01-21 09:22:36.575000-05:00,2021-01-21 09:22:36.575000-05:00,2021-01-21 09:23:38.006000-05:00,QA,Paul Koster,"Analyst, JP Morgan","Yeah, a couple of quick ones. It sounds like the sales team, the biz dev team, are working pretty well in the virtual world. Do you see that changing as we come out the back end of the pandemic? Are you going to go back into a T&E mode, or do you think you've found a new way of developing the business without that expense? And I have a quick follow-up.",Todd Kelsey,President and Chief Executive Officer,"I think, I mean, certainly our business development people, Paul, are looking to get out on the road and looking to get out in front of customers. I mean, to be candid, I'm looking to get out in front of customers more myself. So I think you're going to see travel go up. But I do also think that there's a, I don't think it's going to go up quite to the same level that it had been in the past. I think people are feeling or understanding that there are things that can get done virtually. It can be effective virtually. Our branding and communications team just did an excellent job of creating a great virtual business development environment that I think is really unique that's helping us, but there's still nothing like having a customer in your site to see it firsthand. So So I'm certain that there'll be more movement once it becomes a better environment with the vaccine rollout and such.",positive,0.647,neutral,0.668,positive,0.694,positive,0.39,positive,0.907,positive,0.975,17,0.647,0.0,0.694,0.39,0.907,0.975,6.993,0.0,3.9799999999999995,9.929,14.181000000000001,15.045,0,0,0,0,0,0
PLXS,2021,1,3227.034,3295.783,2021-01-21 09:23:38.006000-05:00,2021-01-21 09:23:47.034000-05:00,2021-01-21 09:23:47.034000-05:00,2021-01-21 09:24:55.783000-05:00,QA,Paul Koster,"Analyst, JP Morgan","Is there anything in the change in the administration in Washington, D.C., that changes anything for you?",Pat Germain,Executive Vice President and Chief Financial Officer,"Yeah, well, we talked about There's, maybe I'll talk about markets and then Pat can talk a little bit more about other factors, but markets, there's a few, and I think it kind of comes back to what happens around stimulus and where's the focus of where dollars are spent. So I think, you know, our heavy equipment business and our industrial sector could benefit, our energy business and our industrial sector could benefit. I think that COVID, particularly around test, could benefit from a market standpoint, and semi-cap is potentially only going to get stronger. So maybe I'll pass it off to Pat, too, for some comments. Sure. I mean, from a tax perspective, Paul, we're watching it closely. Obviously, there's been discussion around increasing the corporate rate and also the offshore earnings tax rate, which would impact us. But we'd want to understand if there's any potential credits that could mitigate some of that increase. Our tax team is closely monitoring it, so we'll just have to see where it falls in a priority with the new administration.",positive,0.523,neutral,0.635,neutral,0.541,positive,0.859,positive,0.852,positive,0.975,18,0.523,0.0,0.0,0.859,0.852,0.975,7.516,0.0,3.9799999999999995,10.788,15.033,16.02,0,0,0,0,0,0
PLXS,2021,1,3341.61,3375.161,2021-01-21 09:24:55.783000-05:00,2021-01-21 09:25:41.610000-05:00,2021-01-21 09:25:41.610000-05:00,2021-01-21 09:26:15.161000-05:00,QA,Anya Soderstrom,"Analyst, Sidoti & Company","Hi, thank you for taking my question. Congrats on a great quarter, and congrats, Sean and Heather. A lot of good questions asked already, but I just wanted to get a sense more of your revenue guidance for the second half. You say it's sort of going to be in line with the fiscal second quarter expectations. Does that assume that electives still stay sort of suppressed, so there could be a surprise upside in the second half that comes back more forcefully?",Todd Kelsey,President and Chief Executive Officer,"Yeah, it does. I mean, basically, it looks at the environment as being more or less what it is today, perhaps even maybe call it a little softer than what we're seeing for the fiscal second quarter, because we saw a lot of drop in upside demand that impacted the second quarter that doesn't necessarily impact Q3 and Q4 at this point. So there's a lot of potential, I think, for for opportunities within the second half. It's just our visibility says it's flat to Q2 right now, more or less.",positive,0.44,neutral,0.671,neutral,0.589,neutral,0.656,positive,0.838,positive,0.849,19,0.44,0.0,0.0,0.0,0.838,0.849,7.9559999999999995,0.0,3.9799999999999995,10.788,15.871,16.869,0,0,0,0,0,0
PLXS,2021,1,3395.394,3444.655,2021-01-21 09:26:15.161000-05:00,2021-01-21 09:26:35.394000-05:00,2021-01-21 09:26:35.394000-05:00,2021-01-21 09:27:24.655000-05:00,QA,Anya Soderstrom,"Analyst, Sidoti & Company","Okay, thank you. And I think you did this a little bit already about the gross margin and ramping new projects might be pressing that because you're guiding to quite ??you had a good performance this quarter and you're guiding for the second quarter to remain relatively high. So how should we think about that going forward?",Todd Kelsey,President and Chief Executive Officer,"Yeah, well, Go ahead, Pat. Yeah, well, I was going to say, as Todd said, I mean, from an operating margin standpoint, we've been really pleased with the last three quarters. So hitting 5% or above would be our target. Expenses we're kind of monitoring, Anya, would be travel expenses and health care costs. Those are things that could be potential headwinds for us. But trying to achieve that 5% or above would be our target. Yeah, and we don't see really a significant drag from new program ramps in the future. I mean, we're somewhat always ramping new programs, and we think the leverage we can get from the other business can offset the costs or the inefficiencies of new program ramps.",positive,0.541,neutral,0.642,positive,0.654,positive,0.965,positive,0.855,positive,0.966,20,0.541,0.0,0.654,0.965,0.855,0.966,8.497,0.0,4.6339999999999995,11.753,16.726,17.835,0,0,0,1,0,0
PLXS,2021,1,3461.236,3485.848,2021-01-21 09:27:24.655000-05:00,2021-01-21 09:27:41.236000-05:00,2021-01-21 09:27:41.236000-05:00,2021-01-21 09:28:05.848000-05:00,QA,Anya Soderstrom,"Analyst, Sidoti & Company","Okay, thank you. And then lastly, in the Army and Defense this quarter, you alluded to some issues with ramping new programs causing the shortfall there. Can you just elaborate on that and talk about how that's going to happen in the coming quarters?",Steve Frisch,Executive Vice President and Chief Operating Officer,"Sure. The space program I mentioned had some delays in the ramp. As you can imagine, programs that are going into outer space, there's a lot of stringent requirements. From a manufacturing process standpoint, We're working with the customer on some strengthening of those requirements, and it slowed down production. We believe we've worked through those and have alignment with the customer on what the requirements are, and so I wouldn't expect it to impact it going forward.",positive,0.441,neutral,0.65,neutral,0.8,neutral,0.816,positive,0.874,positive,0.941,21,0.441,0.0,0.0,0.0,0.874,0.941,8.938,0.0,4.6339999999999995,11.753,17.6,18.776,0,0,0,1,0,0
PLXS,2021,1,3502.677,3524.232,2021-01-21 09:28:05.848000-05:00,2021-01-21 09:28:22.677000-05:00,2021-01-21 09:28:22.677000-05:00,2021-01-21 09:28:44.232000-05:00,QA,Sarah,Operator,"There are no further questions at this time. I would now like to turn the call back to Mr. Todd Kelsey, CEO, for closing remarks.",Todd Kelsey,President and Chief Executive Officer,"All right, thank you, Sarah. I'd like to just start by giving a shout out to our Plexus team members globally and thank them for all their hard work. They continue to perform exceptionally well despite challenging circumstances that are around us today. And again, thank you to everybody who joined our call today. We certainly appreciate your support and your interest in Plexus.",positive,0.489,neutral,0.716,neutral,0.476,neutral,0.552,positive,0.79,positive,0.71,22,0.489,0.0,0.0,0.0,0.79,0.71,9.427,0.0,4.6339999999999995,11.753,18.39,19.486,0,0,0,0,0,0
PLXS,2021,2,1828.327,1865.484,2021-04-22 09:00:24.004000-04:00,2021-04-22 09:00:28.327000-04:00,2021-04-22 09:00:28.327000-04:00,2021-04-22 09:01:05.484000-04:00,QA,Jim Ricciuti,"Analyst, Needham & Company","Hi, good morning. Um, a couple of questions. Um, just with, yeah, I wanted to just focus on the, the supply chain constraints that you're alluding to. And I assume this is all, uh, tied to what we've been hearing about for a while now. Uh, just the chip shortages. Is that basically, uh, representing the bulk of these constraints?",Steve Frisch,"Executive Vice President and Chief Operating Officer, Plexus Corp.","Yes, I would, uh, this is Steve. Um, If you look across the commodities, we track about 60 commodities as a company, and it is a pretty widespread challenge that I think everybody is facing. It's not just us. And if you look at those 60 commodities, there's about 85% of them that we've identified as either pricing increasing or lead time challenges associated with them. So it is a broad-based supply chain challenge. I think our teams are doing an exceptional job working through it, but it's not anything outside of what you've probably heard from other companies in the industry in general. Got it.",positive,0.486,neutral,0.719,neutral,0.72,positive,0.743,positive,0.877,positive,0.968,1,0.486,0.0,0.0,0.743,0.877,0.968,0.486,0.0,0.0,0.743,0.877,0.968,0,0,0,0,0,0
PLXS,2021,2,1904.979,1975.778,2021-04-22 09:01:05.484000-04:00,2021-04-22 09:01:44.979000-04:00,2021-04-22 09:01:44.979000-04:00,2021-04-22 09:02:55.778000-04:00,QA,Jim Ricciuti,"Analyst, Needham & Company","So if we think about, you know, what at least we're hearing out there is that it doesn't sound like this is going to be resolved anytime soon. And so I guess what I'm wondering is, you know, is there a potential risk that this remains a headwind in Q4 for you guys? You know, at the same time that we're hearing about an economy that could grow 6% or more in the U.S. And so it seems like you've got, you know, the potential risk. for customers to, you know, potentially accelerate activity. And so I'm wondering how we should think about that as we, you know, think about Q4 and even early next year.",Todd Kelsey,"President and Chief Executive Officer, Plexus Corp.","Yeah, so it's reasonably comfortable as we look at what our forecast from our customers have been in terms of our ability to secure supply and produce for them. Like I mentioned it last quarter, I think one of the things that we were concerned about and we are seeing is customers that start dropping in upside demand within the quarter, within lead time. It is. It's more difficult for us to deliver for that, and we have a fair amount of revenue that we could capture in the quarter if we could get supply chain. So from my viewpoint, it's more about our ability to capture upside than it is our concern about downside. The one thing I'd add to that too, Jim, and this is Todd, is as we look to Q4 and as we look to Fiscal 22, we're bullish about the demand that's out there, and our supply chain guys are working to clear all the challenges that we have out there. But there's solid demand, and our ability to execute on the demand that comes in under more normal circumstances is as strong as ever. The challenge becomes when you're dropping in things inside the quarter or inside the lead time of certain components that are out there right now.",positive,0.605,neutral,0.624,neutral,0.457,positive,0.74,positive,0.902,positive,0.966,2,0.605,0.0,0.0,0.74,0.902,0.966,1.091,0.0,0.0,1.483,1.779,1.934,0,0,0,0,0,0
PLXS,2021,2,1996.705,2039.275,2021-04-22 09:02:55.778000-04:00,2021-04-22 09:03:16.705000-04:00,2021-04-22 09:03:16.705000-04:00,2021-04-22 09:03:59.275000-04:00,QA,Jim Ricciuti,"Analyst, Needham & Company","Got it. Just a final question. I'm wondering if you called out this aftermarket services engagement. I'm wondering if you could say anything more about that with respect to size, type of customer, and whether this is maybe an area that you think you're going to be able to further leverage your capabilities with maybe other customers like this.",Todd Kelsey,"President and Chief Executive Officer, Plexus Corp.","Yeah, we're really excited about this one, Jim. And it's a healthcare customer is what I'll say. I won't get into any details of the product lines. But it's across all three of our regions. It's many different sites. It's significant from a revenue standpoint. So we've talked about aftermarket and our ability in the longer term to be able to grow it to 5% to 10% of revenue. I think this is a good step in that direction. I mean, this opportunity by itself could get us to a pretty meaningful level of revenue within aftermarket, and especially when you put it on top of the the book of business that's already within our aftermarket offering.",positive,0.568,neutral,0.668,positive,0.717,positive,0.7,positive,0.827,positive,0.964,3,0.568,0.0,0.717,0.7,0.827,0.964,1.6589999999999998,0.0,0.717,2.183,2.606,2.8979999999999997,0,0,0,0,0,0
PLXS,2021,2,2080.463,2130.417,2021-04-22 09:03:59.275000-04:00,2021-04-22 09:04:40.463000-04:00,2021-04-22 09:04:40.463000-04:00,2021-04-22 09:05:30.417000-04:00,QA,David Williams,"Analyst, Loop Capital","Good morning, and thanks for taking my question. And congrats on the solid quarter. I guess my first question really is around some of the shortages you're seeing, and you provided some color there. Just kind of curious what your thoughts are in terms of how that may be impacting your customers. So beyond the manufacturing process, but once it gets to your customers, do you get a sense that maybe they're facing any shortage issues that may be constraining their ability to sell into their markets?",Todd Kelsey,"President and Chief Executive Officer, Plexus Corp.","I would say, you know, typically a lot of the stuff that we're doing is pretty close to a finished good. Our customers do add value in some areas. So I don't believe that they're getting significant constraints beyond what, as long as we're able to deliver, I think for the most part they're able to deliver. With that said, I mean, obviously there's some customers that have secondary things and other products that they add to it. But I think the biggest challenge has been more on the electronics than other things at this point. The other thing I'd add to on that, David, is we're seeing really strong demand from our semiconductor capital equipment customers, of course, because they're the ones who can help the fabs and the manufacturers get beyond the situation that we're in right now.",positive,0.585,neutral,0.642,positive,0.584,neutral,0.722,positive,0.759,positive,0.961,4,0.585,0.0,0.584,0.0,0.759,0.961,2.2439999999999998,0.0,1.301,2.183,3.365,3.859,0,0,0,0,0,0
PLXS,2021,2,2147.942,2175.526,2021-04-22 09:05:30.417000-04:00,2021-04-22 09:05:47.942000-04:00,2021-04-22 09:05:47.942000-04:00,2021-04-22 09:06:15.526000-04:00,QA,David Williams,"Analyst, Loop Capital","That definitely makes good sense. And I guess the tone from your customers from their in-demand, are they seeing, I guess, are you seeing, I guess, the drop in orders at the same pace you did at the previous quarter? How are you thinking about in-demand? Is that accelerating or what has that pace been like, I guess?",Todd Kelsey,"President and Chief Executive Officer, Plexus Corp.","The demand environment itself is just really strong right now. I mean, if we look at what we saw in the And the out-quarters one quarter ago versus today, it's completely different. I mean, particularly within our industrial sector where semiconductor capital equipment and communications are very strong, and then in healthcare where elective is coming up very rapidly. So we're seeing major demand increases across those two sectors in particular.",positive,0.529,neutral,0.71,neutral,0.552,neutral,0.549,positive,0.908,positive,0.946,5,0.529,0.0,0.0,0.0,0.908,0.946,2.7729999999999997,0.0,1.301,2.183,4.273,4.805,0,0,0,0,0,0
PLXS,2021,2,2204.976,2259.449,2021-04-22 09:06:15.526000-04:00,2021-04-22 09:06:44.976000-04:00,2021-04-22 09:06:44.976000-04:00,2021-04-22 09:07:39.449000-04:00,QA,David Williams,"Analyst, Loop Capital","Great. And then lastly for me maybe is the industrial segment is an area that we thought would see a nice uptick as we kind of got through COVID here, and it seems like maybe some of the automation is finally becoming a bigger play there. What is your sense in terms of that segment in particular and just the demand that you're seeing now? Do you think this is something that maybe we're in the beginning of a new cycle for some of the industrial, especially on automation, or do you think this is maybe just a blip and it settles down as we get into next year?",Steve Frisch,"Executive Vice President and Chief Operating Officer, Plexus Corp.","Yes, I'll just hit specifically on the warehouse and factory automation, and then maybe Steve can provide a little bit more color on the sector overall. But that's one of the areas I'm going to highlight a bit in my script. We're very excited about a few different program ramps that we have going on in there, and we think it's a huge secular growth market for us with just outstanding potential. It's particularly an F-22 type event for us, not a Not really an F21 in a major way, but we're very excited about what's happening within warehouse and factory automation. Yeah, I mean, just to reiterate what Todd said, I think we've got two things going on. One is that we are winning new customers and taking market share in that space, and that market space is also set for growth. And so you've got both things going and working in the right direction. So as Todd said, we're pretty optimistic about that as we get into 22. Great.",positive,0.563,neutral,0.698,positive,0.741,positive,0.737,positive,0.886,positive,0.96,6,0.563,0.0,0.741,0.737,0.886,0.96,3.336,0.0,2.042,2.92,5.159,5.765,0,0,1,0,0,0
PLXS,2021,2,2263.352,2264.583,2021-04-22 09:07:39.449000-04:00,2021-04-22 09:07:43.352000-04:00,2021-04-22 09:07:43.352000-04:00,2021-04-22 09:07:44.583000-04:00,QA,David Williams,"Analyst, Loop Capital","Thanks so much. Appreciate the time, guys.",Todd Kelsey,"President and Chief Executive Officer, Plexus Corp.","Thank you, David.",neutral,0.581,neutral,0.725,neutral,0.863,neutral,0.598,positive,0.559,positive,0.672,7,0.0,0.0,0.0,0.0,0.559,0.672,3.336,0.0,2.042,2.92,5.718,6.436999999999999,0,0,1,0,0,0
PLXS,2021,2,2316.484,2455.571,2021-04-22 09:07:44.583000-04:00,2021-04-22 09:08:36.484000-04:00,2021-04-22 09:08:36.484000-04:00,2021-04-22 09:10:55.571000-04:00,QA,Adam Tindall,"Analyst, Raymond James","Okay, thanks. Todd, I just wanted to start on winds and funnel, another healthy quarter here. Maybe you could touch on the composition of the incremental winds from a profitability profile basis. As those layer in, what sort of kind of gross and operating margin profile on that incremental contribution? And then secondly, for Steve, Just kind of on this topic, from an operating standpoint, recognize these wins are healthy. What lanes do the salespeople have to work within, and maybe why not expand those lanes given margins are at record levels, economic return is so far in excess of cost of capital? You talked about passing on a large outsourcing opportunity, so just wanted to ask from an operating standpoint, why not expand the lanes? Thank you.",Todd Kelsey,"President and Chief Executive Officer, Plexus Corp.","Yeah, so from a standpoint of the margin profile of the new wins, I would say they fit nicely within our model. And what we do is we give our sector leaders the leeway to be able to manage their portfolio as a book of business. And, you know, they know that as they bring in certain new business, it'll be at lower margins as it typically is as it ramps up, and particularly with new customers. But then they layer on top of that some better margin business and, in essence ??run a portfolio that meets their targets. So we give them a lot of leeway, but in general, they're good at targeting business that fits the type of financial model that we want to deliver. Yeah, and I'll take the second part. The sector teams have a pretty significant amount of leeway in terms of what they want to do. And for me, a couple examples are, you know, the healthcare team, life sciences team going after robotic surgery, the industrial team going after automation and warehouse automation and the aerospace and defense sector going after space products. And so they're quite free to go chase where they believe the future business is going to go as long as it falls in line with our overall Plexus strategy. On the specific opportunity you talked about, I'm glad you brought it up because to me it really demonstrates the, I'd say, the discipline that the teams have. In this specific example, The customer is switching more from a hardware platform to more of a software platform. That's where their industry is going. And to be honest with you, this one would have probably been a nice revenue pop for the next year or two, but we really saw that that end market was getting a bit ??probably going to be a bit more commoditized, and the volume of products they need is going to go down. And so although we would have chased it, won it, and it would have been margin challenged in the beginning, we also believe that it wasn't necessarily the right thing long-term either. And so It's sometimes always hard to walk away from revenue and an opportunity, but to me it's really the impressive part of what our teams have been able to do to go, quite frankly, chase the right business and the stuff that isn't right for us they walk away from. So I was pretty impressed with their decision. One additional thing I'd add on that as well, Adam, is when we think about our markets and our pricing, we believe that at our financial model our markets support the low double-digit growth target that we have.",positive,0.64,neutral,0.584,positive,0.672,positive,0.917,positive,0.916,positive,0.977,8,0.64,0.0,0.672,0.917,0.916,0.977,3.976,0.0,2.714,3.8369999999999997,6.634,7.414,1,0,0,1,0,0
