tic,year,quarter,timestamp_Q,timestamp_A,timestamp_et_q_start,timestamp_et_q_end,timestamp_et_a_start,timestamp_et_a_end,section,speaker_name_Q,speaker_title_Q,question_text,speaker_name_A,speaker_title_A,answer_text,assertive_label,assertive_score,cautious_label,cautious_score,optimistic_label,optimistic_score,specific_label,specific_score,clear_label,clear_score,relevant_label,relevant_score,sent_section_id,qa_assertive_signed,qa_cautious_signed,qa_optimistic_signed,qa_specific_signed,qa_clear_signed,qa_relevant_signed,qa_assertive_cumulative,qa_cautious_cumulative,qa_optimistic_cumulative,qa_specific_cumulative,qa_clear_cumulative,qa_relevant_cumulative,qa_assertive_sentence_level_CP,qa_cautious_sentence_level_CP,qa_optimistic_sentence_level_CP,qa_specific_sentence_level_CP,qa_clear_sentence_level_CP,qa_relevant_sentence_level_CP
PLXS,2021,2,2494.032,2524.183,2021-04-22 09:10:55.571000-04:00,2021-04-22 09:11:34.032000-04:00,2021-04-22 09:11:34.032000-04:00,2021-04-22 09:12:04.183000-04:00,QA,Adam Tindall,"Analyst, Raymond James","Yes, that makes sense and helpful, Cole. I appreciate it. Maybe just a follow-up for Pat. One of the other impressive stories that you've driven so far at the company is the OPEX trends. Ratios have improved significantly. You've had productivity gains, expense management. I remember years ago trying to get below 5% operating expenses at percent of revenue, and you're now pushing to the low 4% range. Just talk about the trajectory from here on OpEx. You know, is the right way to think about the normalized model still mid-4%? Has it become lower than that? Is there additional opportunity? Just maybe just walk us through the OpEx line. Thank you.",Pat Germain,"Executive Vice President and Chief Financial Officer, Plexus Corp.","Sure. Yeah, I think there is opportunity. I think we're still going to be operating within this four to four and a half range, though, depending on investments we make in certain quarters. But I think it does have the ability to trend down, especially if we're driving double-digit top-line growth, we can really leverage our OpEx expenses to see some improvement. But I think, Adam, working within that low fours is probably reasonable going forward.",positive,0.539,neutral,0.646,positive,0.653,positive,0.925,positive,0.843,positive,0.966,9,0.539,0.0,0.653,0.925,0.843,0.966,4.515,0.0,3.367,4.7620000000000005,7.477,8.379999999999999,0,0,0,0,0,0
PLXS,2021,2,2527.323,2528.663,2021-04-22 09:12:04.183000-04:00,2021-04-22 09:12:07.323000-04:00,2021-04-22 09:12:07.323000-04:00,2021-04-22 09:12:08.663000-04:00,QA,Adam Tindall,"Analyst, Raymond James",Understood. Thank you very much.,Pat Germain,"Executive Vice President and Chief Financial Officer, Plexus Corp.","Thanks, Adam.",neutral,0.601,neutral,0.714,neutral,0.861,neutral,0.59,positive,0.53,positive,0.616,10,0.0,0.0,0.0,0.0,0.53,0.616,4.515,0.0,3.367,4.7620000000000005,8.007,8.996,0,0,0,1,0,1
PLXS,2021,2,2562.743,2639.035,2021-04-22 09:12:08.663000-04:00,2021-04-22 09:12:42.743000-04:00,2021-04-22 09:12:42.743000-04:00,2021-04-22 09:13:59.035000-04:00,QA,Steven Fox,"Analyst, Fox Advisors","Hi. I guess I had another question just on the component supply situation. During the quarter, you guys actually reduced inventories, even though things were sort of tightening up. So I know you don't speculate on inventory, but why weren't you able to convince some of your customers to maybe sort of get ahead of the curve so that you maybe have opportunities to do some upside, to produce some upside? And then I had a follow-up question.",Steve Frisch,"Executive Vice President and Chief Operating Officer, Plexus Corp.","Yeah, I would say that some of our customers did get ahead of it. We were definitely building inventory for a few customers, especially in semiconductor capital equipment. And as Pat talked about, the deposits that some of our customers put, they were asking us to get ahead of the financial forecast as they saw it coming. I would say some other industries, specifically like the elective procedures and healthcare life sciences, it's coming back a little bit quicker than what people thought. And so, you know, there is a question about you know, how quickly they should have brought in inventory and working with them. I can tell you that in our aerospace customers, we are having those conversations with some of our aerospace customers now about starting to procure inventory for the eventual return of that market. So it's a case-by-case situation, and we are doing that, and we're working effectively with customers in many cases. Other cases, It's really about a belief in terms of what their forecasts are going to be. So I think we've got a good balance, and we're able to do that. In terms of inventories, the dollar numbers, from a dollar standpoint, it's up. Days were down as we looked through the quarter here. So you will see inventories continue to build here for a little bit before we start to bleed them off as the markets clear up a little bit.",positive,0.596,neutral,0.666,positive,0.576,positive,0.7,positive,0.9,positive,0.974,11,0.596,0.0,0.576,0.7,0.9,0.974,5.111,0.0,3.943,5.462,8.907,9.969999999999999,0,0,0,0,1,1
PLXS,2021,2,2660.576,2690.172,2021-04-22 09:13:59.035000-04:00,2021-04-22 09:14:20.576000-04:00,2021-04-22 09:14:20.576000-04:00,2021-04-22 09:14:50.172000-04:00,QA,Steven Fox,"Analyst, Fox Advisors","Great, that's helpful. And then just on the labor shortages, you mentioned this sort of headwind. Can you just sort of go into some more details on whether that was your own facilities or further up or down the supply chain and how you expect that to clear, given that, you know, other regions outside the U.S. still seem to be struggling with COVID? Thanks.",Todd Kelsey,"President and Chief Executive Officer, Plexus Corp.","Yeah, so it was related to our facilities, and basically we had a number of positive cases that allowed us to lose some time late in the quarter. And, I mean, generally it's just one of those things that we've been managing through and been managing very effectively. The thing why it became an issue this quarter is because it was so late in the quarter there wasn't enough time to recover. But generally we're able to recover from those without really much of an impact.",positive,0.42,neutral,0.671,neutral,0.77,neutral,0.761,positive,0.822,positive,0.87,12,0.42,0.0,0.0,0.0,0.822,0.87,5.531,0.0,3.943,5.462,9.729,10.84,0,0,0,0,0,0
PLXS,2021,2,2726.98,2749.899,2021-04-22 09:14:50.172000-04:00,2021-04-22 09:15:26.980000-04:00,2021-04-22 09:15:26.980000-04:00,2021-04-22 09:15:49.899000-04:00,QA,Matt Sheeran,"Analyst, Stiefel","Another follow-up regarding the supply constraints. Could you quantify any missed upside opportunity? You talked, Steve, about some headwinds in terms of revenue on SemiCap, even though it sounds like customers are trying to get ahead of it. Are we talking about like a 5% opportunity missed? Could you just quantify that?",Steve Frisch,"Executive Vice President and Chief Operating Officer, Plexus Corp.","Sure. The upside that we saw on the fiscal second quarter that customers dropped in was probably $10 to $15 million. But as quickly as it got dropped in, there was no way we were going to realize that. What we're looking at for the current fiscal quarter is about $40 to $50 million of demand that we do not have loaded into our financial forecast that if we could get materials we think we could execute on.",positive,0.47,neutral,0.684,neutral,0.815,positive,0.694,positive,0.865,positive,0.884,13,0.47,0.0,0.0,0.694,0.865,0.884,6.0009999999999994,0.0,3.943,6.156,10.594,11.724,0,0,0,0,0,0
PLXS,2021,2,2761.822,2790.427,2021-04-22 09:15:49.899000-04:00,2021-04-22 09:16:01.822000-04:00,2021-04-22 09:16:01.822000-04:00,2021-04-22 09:16:30.427000-04:00,QA,Matt Sheeran,"Analyst, Stiefel","Okay, great. And are you seeing those projects then get just pushed out, and as the component constraints ease, you'll start to see some acceleration there?",Steve Frisch,"Executive Vice President and Chief Operating Officer, Plexus Corp.","Yeah, that's a great question. I would say that we do believe some of the demand is going to push, and we do see it building in future quarters. One of the conversations we're having with customers is how much of it is perishable. I would say it's a little early to quantify exactly that entire $40 million to $50 million going to be realized in future quarters, versus how much is perishable. But I guess my message to you is that some of it's going to push, some of it's going to be perishable, but we haven't really been able to quantify it completely yet.",positive,0.467,neutral,0.679,neutral,0.556,positive,0.749,positive,0.873,positive,0.921,14,0.467,0.0,0.0,0.749,0.873,0.921,6.468,0.0,3.943,6.905,11.467,12.645,0,0,0,0,0,0
PLXS,2021,2,2813.222,2847.192,2021-04-22 09:16:30.427000-04:00,2021-04-22 09:16:53.222000-04:00,2021-04-22 09:16:53.222000-04:00,2021-04-22 09:17:27.192000-04:00,QA,Matt Sheeran,"Analyst, Stiefel","Okay, great. And on the aerospace side, it sounds like fundamentals are bottoming there. And do you expect to sort of bounce along the bottom here for a couple, three quarters? Or is there any signs, for instance, MRO picking up or any sort of indicators that that give you some more confidence that it's going to be, you know, a faster recovery?",Todd Kelsey,"President and Chief Executive Officer, Plexus Corp.","Yeah. So what we expect is this quarter to be kind of somewhat around the bottom, and then it starts to pick up a bit. What we're seeing pick up right now is MROs. as well as business jets is picking up rather nicely right now. Now, we think that the next thing to come would be the single aisle, but that's probably a few quarters out yet. And then it could be a long time before we start to see the multi-aisle start to pick up within commercial aerospace.",positive,0.482,neutral,0.706,positive,0.525,neutral,0.594,positive,0.858,positive,0.804,15,0.482,0.0,0.525,0.0,0.858,0.804,6.95,0.0,4.468,6.905,12.325,13.449,0,0,0,0,0,0
PLXS,2021,2,2872.041,2910.281,2021-04-22 09:17:27.192000-04:00,2021-04-22 09:17:52.041000-04:00,2021-04-22 09:17:52.041000-04:00,2021-04-22 09:18:30.281000-04:00,QA,Matt Sheeran,"Analyst, Stiefel","Okay. And lastly, just a quick housekeeping for Pat regarding how we should be thinking about interest expense and tax rate beyond what you're guiding to for the June quarter, sort of guiding or modeling Flattish in our quarters? Does that make sense? Or would the interest expense change based on working capital or other metrics?",Pat Germain,"Executive Vice President and Chief Financial Officer, Plexus Corp.","Yeah, I think our interest expense, if you're looking at other income expense that I guide, I think we could see that come down a million or two going into fiscal 22. with lower interest expense if we keep the capital structure the way it is. Tax rate is real uncertainty at this point. I think what I can tell you is we're in the same boat as every other company that if changes go through, our tax expense is going to go up, whether it's domestic tax or offshore profit, tax on offshore profits. So very similar to other companies there.",positive,0.445,neutral,0.678,neutral,0.775,positive,0.783,positive,0.858,positive,0.941,16,0.445,0.0,0.0,0.783,0.858,0.941,7.395,0.0,4.468,7.688,13.183,14.39,0,0,0,0,0,0
PLXS,2021,2,2954.904,3002.216,2021-04-22 09:18:30.281000-04:00,2021-04-22 09:19:14.904000-04:00,2021-04-22 09:19:14.904000-04:00,2021-04-22 09:20:02.216000-04:00,QA,Paul Cheung,"Analyst, JP Morgan","Hi, this is Paul Cheung on for Koster. Thanks for taking my question. So just on competition, can you expand on the pricing environment? Your peers are also seeing pretty strong margin performance. Just your thoughts on the reasons behind the more favorable pricing environment in your view? and how to continue to stay disciplined on pricing and your expectations over the year and longer term for the industry?",Todd Kelsey,"President and Chief Executive Officer, Plexus Corp.","In general, there's just a lot more discipline in the pricing environment and the current environment than there had been maybe previously within our industry. So I think that's good for everybody. I mean, of course, there's a lot of newer management teams that are in the various competitors that we have, which I think that That's factored into it quite a lot, and it's been a good environment from a pricing standpoint. But, you know, I mean, in ways, though, partly for us, too, we've tried to stake out differentiated positions where perhaps we're not ??it's not solely a price or a price competition that's going on, but it's more of a capabilities competition that's going on. So that's one of the things that works in our favor as well.",positive,0.645,neutral,0.63,positive,0.722,positive,0.424,positive,0.851,positive,0.966,17,0.645,0.0,0.722,0.424,0.851,0.966,8.04,0.0,5.1899999999999995,8.112,14.034,15.356,0,0,0,0,0,0
PLXS,2021,2,3028.223,3099.54,2021-04-22 09:20:02.216000-04:00,2021-04-22 09:20:28.223000-04:00,2021-04-22 09:20:28.223000-04:00,2021-04-22 09:21:39.540000-04:00,QA,Paul Cheung,"Analyst, JP Morgan","Gotcha. And then as we kind of think about post-COVID, you know, do you expect some of your existing customers to kind of accelerate the shift to outsource manufacturing? And, you know, how are those conversations evolving? And then same question for new customers and new logos. And then, you know, anything you want to call out in Asia and the particular strength there?",Steve Frisch,"Executive Vice President and Chief Operating Officer, Plexus Corp.","In terms of our customers outsourcing, I think any time there's a, a disruption, whether it's COVID or a recession or something like that, I think customers in general take a look at their sourcing strategies and adjust them. And so we are seeing a little bit of an uptick in customers looking at their strategies. The one Todd talked about for aftermarket services is one where a customer looked at it and said, hey, we're going to start outsourcing this. I talked about a win where a customer is transitioning from internal production to external production. And so anytime there's a disruption in it causes people to ??we see an uptick in those kind of decisions. And so I wouldn't be surprised if we see a bit more as we go forward. In terms of APAC, I mean, our HPAC team just continues to execute really, really well. The strategy that we have over there is working well. Our expansion into Thailand is to add capacity in Southeast Asia as we see our facilities in Malaysia start to get more full. And so I would say it's kind of steady as it goes. The team's winning, you know, as you saw this quarter, one record wins. So we're really satisfied with what's happening over there.",positive,0.599,neutral,0.683,positive,0.617,positive,0.718,positive,0.944,positive,0.967,18,0.599,0.0,0.617,0.718,0.944,0.967,8.639,0.0,5.807,8.83,14.978,16.323,0,0,0,0,0,0
PLXS,2021,2,3129.248,3167.773,2021-04-22 09:21:39.540000-04:00,2021-04-22 09:22:09.248000-04:00,2021-04-22 09:22:09.248000-04:00,2021-04-22 09:22:47.773000-04:00,QA,Paul Cheung,"Analyst, JP Morgan","Okay, great. And then lastly, for Pat, on free cash flow, if I, you know, take your guidance for 3Q, assuming there might be maybe slight usage, but, you know, 4Q has been quite strong for, The past two years, it's hit close to $100 million on average. So any thoughts on the kind of annual free cash flow guide? Is there some conservatism baked in there? Thanks.",Pat Germain,"Executive Vice President and Chief Financial Officer, Plexus Corp.","Yeah, like I said, Paul, some of it's going to depend on timing of capital expenditures for Thailand. We've got $23 million in this year, and some of that could push to next year, which would improve our free cash flow. we're going to be procuring quite a bit for the growth we expect in fiscal 22. And I think that will impact our working capital and increase our investments. And that is factored into my numbers. So I think still around $100 million is reasonable, depending on kind of how next year shapes up. And we'll know more about that over the next three months.",positive,0.493,neutral,0.691,neutral,0.471,positive,0.781,positive,0.822,positive,0.957,19,0.493,0.0,0.0,0.781,0.822,0.957,9.132,0.0,5.807,9.611,15.8,17.28,0,0,0,0,0,0
PLXS,2021,2,3170.415,3172.957,2021-04-22 09:22:47.773000-04:00,2021-04-22 09:22:50.415000-04:00,2021-04-22 09:22:50.415000-04:00,2021-04-22 09:22:52.957000-04:00,QA,Paul Cheung,"Analyst, JP Morgan","Okay, great. Thank you.",Pat Germain,"Executive Vice President and Chief Financial Officer, Plexus Corp.","You're welcome. Thanks, Paul.",neutral,0.609,neutral,0.752,neutral,0.902,neutral,0.573,positive,0.54,positive,0.669,20,0.0,0.0,0.0,0.0,0.54,0.669,9.132,0.0,5.807,9.611,16.34,17.948999999999998,0,0,0,0,0,0
PLXS,2021,2,3205.671,3258.593,2021-04-22 09:22:52.957000-04:00,2021-04-22 09:23:25.671000-04:00,2021-04-22 09:23:25.671000-04:00,2021-04-22 09:24:18.593000-04:00,QA,Aja Soderstrom,"Analyst, Sidoti Company","Thank you for taking my question, and congratulations on a great quarter. A lot of good questions asked already, but I have a question on the Thailand expansion. When that is ramping and you expect the margins to be a little bit pressured, right, is there any other parts of your business that you can push to make up for that pressure?",Todd Kelsey,"President and Chief Executive Officer, Plexus Corp.","Yeah, I think in general the answer is yes, Anya, and we don't anticipate our margins to suffer as the Thailand facility is coming online. There's a couple of factors in that, too. I mean, one, and Steve had already mentioned the performance of the APAC team But our APAC team is incredibly efficient at launching new facilities and bringing them to corporate-level profitability. So we have high confidence they'll be able to do it in very short order. But we do have other parts of the business that we're investing in right now that we anticipate margins will come up to, in essence, be able to offset the Thailand expansion, and that includes aftermarket. We're not at our target level there. Mayo, we're not at our target level yet. So we have opportunities. We have opportunities to bring up margins to offset any Thailand investment.",positive,0.599,neutral,0.653,positive,0.666,neutral,0.467,positive,0.935,positive,0.974,21,0.599,0.0,0.666,0.0,0.935,0.974,9.731,0.0,6.473,9.611,17.275,18.923,1,0,0,0,1,0
PLXS,2021,2,3273.377,3309.609,2021-04-22 09:24:18.593000-04:00,2021-04-22 09:24:33.377000-04:00,2021-04-22 09:24:33.377000-04:00,2021-04-22 09:25:09.609000-04:00,QA,Aja Soderstrom,"Analyst, Sidoti Company","Okay, thank you. And in order in India, the manufacturing winds have been a bit softer over the past couple of quarters. What are you seeing there? Is that like COVID-related or is there anything else?",Steve Frisch,"Executive Vice President and Chief Operating Officer, Plexus Corp.","Yeah, the... I don't know if I completely comprehend. I mean, the manufacturing winds have actually been quite strong over the past couple of quarters. If I look back over fiscal 20 and into 21 here, you know, for the most part, we've been at $250 million or north of it for quite some time. And so I guess the, you know, I think the teams are doing a great job bringing in the winds that we need to continue to support the growth. And if I look at our trailing four-quarter winds metric, sitting at 30%. I mean, we're well above our 25% goal. So we're actually pretty pleased with the number of wins that we've had.",positive,0.54,neutral,0.711,positive,0.717,positive,0.807,positive,0.913,positive,0.969,22,0.54,0.0,0.717,0.807,0.913,0.969,10.270999999999999,0.0,7.1899999999999995,10.418,18.188,19.892,0,0,0,0,0,0
PLXS,2021,2,3318.654,3352.861,2021-04-22 09:25:09.609000-04:00,2021-04-22 09:25:18.654000-04:00,2021-04-22 09:25:18.654000-04:00,2021-04-22 09:25:52.861000-04:00,QA,Aja Soderstrom,"Analyst, Sidoti Company","Okay, I was more alluding to the European and Middle East wins for regional color.",Steve Frisch,"Executive Vice President and Chief Operating Officer, Plexus Corp.","Yeah, I'll say for regional color, EMEA is the one, you know, if you look at that region, you know, their wins have been, you know, they have a trailing four-quarter numbers of 144 million, which it is a smaller region for us. that supports growth. It doesn't, as Todd highlighted, it doesn't support maybe the corporate growth goals that we want. And, you know, so that is definitely an area for focus for us to basically be able to add wins there to basically allow us to continue to support our growth there. But we're growing. It's just not at the rate that we want to. But, again, we feel comfortable with our strategy there.",positive,0.527,neutral,0.679,neutral,0.462,positive,0.525,positive,0.913,positive,0.908,23,0.527,0.0,0.0,0.525,0.913,0.908,10.798,0.0,7.1899999999999995,10.943,19.101,20.8,0,0,0,0,0,0
PLXS,2021,2,3366.745,3390.299,2021-04-22 09:25:52.861000-04:00,2021-04-22 09:26:06.745000-04:00,2021-04-22 09:26:06.745000-04:00,2021-04-22 09:26:30.299000-04:00,QA,Tiffany,Operator,"At this time, I'm currently showing no further questions in queue. I will now turn the call back over to Mr.",Todd Kelsey,"President and Chief Executive Officer, Plexus Corp.","All right. And before closing, I'd again like to thank our Plexus team members globally. I want to thank you for your exceptional performance, another excellent quarter, and for continuing to work incredibly hard to meet the needs of our customers. And I also want to thank everybody who joined our call today. Again, we appreciate your interest in Plexus, and we appreciate your support.",positive,0.502,neutral,0.72,neutral,0.484,neutral,0.455,positive,0.858,positive,0.755,24,0.502,0.0,0.0,0.0,0.858,0.755,11.3,0.0,7.1899999999999995,10.943,19.959,21.555,0,0,0,0,0,0
PLXS,2021,3,1827.446,1914.484,2021-07-22 09:00:26.606000-04:00,2021-07-22 09:00:27.446000-04:00,2021-07-22 09:00:27.446000-04:00,2021-07-22 09:01:54.484000-04:00,QA,Jim,Analyst at Mead Ham and Company,"Hi, thank you. Just a couple of questions. You highlighted the fact that the industrial wind's was down in the quarter sequentially. And you're also suggesting a recovery in fiscal Q4. And I'm just wondering what you're seeing there. And I guess the broader question I'm having is, do you have any sense if the supply chain issues that we've all been hearing about are beginning to or potentially impacting WINS in this or any other areas of the business, just because it's been so broadly based across different market verticals, what we're seeing in terms of supply chain. And a follow-up on that is I'm wondering if there's any way of quantifying potentially what type of headwind you might be anticipating from component availability in Q4. Thank you.",Steve Frisch,Executive Vice President and Chief Operating Officer,"Sure. Maybe I'll hit the second part first, which was focused on the supply chain impact on WINS. I don't believe that the supply chain right now is impacting the funnel or the wins rate. Really couldn't correlate anything happening there. So I think we're at normal levels. Specifically as it relates to the industrial wins in Q3, I wouldn't read too much into that either. We do not measure the teams by a quarterly number. For us, it doesn't really matter whether we win it at the end of the last day of the quarter or the beginning of the next quarter. And so we don't incentivize the teams to try and close something to meet a quarterly metric. That's why we focus quite heavily on the trailing four quarter wins number. So it was a softer quarter, but like I said, I expect Q4 to come back to a healthy level. So again, I wouldn't read anything too much into that either. In terms of headwinds as we, in terms of the revenue that we're forecast that we have in front of us for Q4, there is a sizable customer forecast that we're unable to achieve in Q4 due to component supply chains. you know, quite frankly, you rolled up the numbers would be in excess of a hundred million dollars with that said, um, even if we could procure a hundred million dollars with the components, then we'd have to start talking about the labor and the manufacturing capacity to be able to do that. So, um, so from an overall standpoint, um, there's a lot of demand out there. And, uh, um, again, I don't, from an opportunity standpoint, the teams are working aggressively to close it.",positive,0.52,neutral,0.632,neutral,0.524,positive,0.952,positive,0.922,positive,0.978,1,0.52,0.0,0.0,0.952,0.922,0.978,0.52,0.0,0.0,0.952,0.922,0.978,0,0,0,0,0,0
